Category,Message
Spam,thesmszone.com lets you send free anonymous and masked messages..im sending this message from there..do you see the potential for abuse???
Spam,Promotion Number: 8714714 - UR awarded a City Break and could WIN a £200 Summer Shopping spree every WK. Txt STORE to 88039 . SkilGme. TsCs087147403231Winawk!Age16 £1.50perWKsub
Not Spam,I.ll give her once i have it. Plus she said grinule greet you whenever we speak
Spam,Do you want a New Nokia 3510i Colour Phone Delivered Tomorrow? With 200 FREE minutes to any mobile + 100 FREE text + FREE camcorder Reply or Call 8000930705
Spam,"Call 09094100151 to use ur mins! Calls cast 10p/min (mob vary). Service provided by AOM, just GBP5/month. AOM Box61,M60 1ER until u stop. Ages 18+ only!"
Not Spam,Ok thanx... Take care then...
Spam,Kit Strip - you have been billed 150p. Netcollex Ltd. PO Box 1013 IG11 OJA
Not Spam,Meet after lunch la...
Not Spam,K I'll be sure to get up before noon and see what's what
Spam,Urgent Ur £500 guaranteed award is still unclaimed! Call 09066368327 NOW closingdate04/09/02 claimcode M39M51 £1.50pmmorefrommobile2Bremoved-MobyPOBox734LS27YF
Not Spam,Lol they were mad at first but then they woke up and gave in.
Not Spam,Good morning princess! Have a great day!
Spam,"Our dating service has been asked 2 contact U by someone shy! CALL 09058091870 NOW all will be revealed. POBox84, M26 3UZ 150p"
Spam,Win a £1000 cash prize or a prize worth £5000
Not Spam,"Just got part Nottingham - 3 hrs 63miles. Good thing i love my man so much, but only doing 40mph. Hey ho"
Spam,"You are being contacted by our Dating Service by someone you know! To find out who it is, call from your mobile or landline 09064017305 PoBox75LDNS7"
Spam,Missed call alert. These numbers called but left no message. 07008009200
Spam,"Someone has contacted our dating service and entered your phone becausethey fancy you! To find out who it is call from a landline 09058098002. PoBox1, W14RG 150p"
Spam,You are being ripped off! Get your mobile content from www.clubmoby.com call 08717509990 poly/true/Pix/Ringtones/Games six downloads for only 3
Spam,"Spook up your mob with a Halloween collection of a logo & pic message plus a free eerie tone, txt CARD SPOOK to 8007 zed 08701417012150p per logo/pic"
Spam,(Bank of Granite issues Strong-Buy) EXPLOSIVE PICK FOR OUR MEMBERS *****UP OVER 300% *********** Nasdaq Symbol CDGT That is a $5.00 per..
Not Spam,I'll text now! All creepy like so he won't think that we forgot
Not Spam,Hope you are having a great new semester. Do wish you the very best. You are made for greatness.
Not Spam,"What do u reckon as need 2 arrange transport if u can't do it, thanks"
Spam,Congratulations ur awarded 500 of CD vouchers or 125gift guaranteed & Free entry 2 100 wkly draw txt MUSIC to 87066
Spam,"FREE2DAY sexy St George's Day pic of Jordan!Txt PIC to 89080 dont miss out, then every wk a saucy celeb!4 more pics c PocketBabe.co.uk 0870241182716 £3/wk"
Spam,Santa Calling! Would your little ones like a call from Santa Xmas eve? Call 09058094583 to book your time.
Spam,Married local women looking for discreet action now! 5 real matches instantly to your phone. Text MATCH to 69969 Msg cost 150p 2 stop txt stop BCMSFWC1N3XX
Spam,PRIVATE! Your 2003 Account Statement for shows 800 un-redeemed S. I. M. points. Call 08718738002 Identifier Code: 48922 Expires 21/11/04
Not Spam,When u love someone Dont make them to love u as much as u do. But Love them so much that they dont want to be loved by anyone except you... Gud nit.
Not Spam,Ok.
Not Spam,Here got lots of hair dresser fr china.
Spam,"This is the 2nd time we have tried to contact u. U have won the £400 prize. 2 claim is easy, just call 087104711148 NOW! Only 10p per minute. BT-national-rate"
Spam,I don't know u and u don't know me. Send CHAT to 86688 now and let's find each other! Only 150p/Msg rcvd. HG/Suite342/2Lands/Row/W1J6HL LDN. 18 years or over.
Not Spam,If i start sending blackberry torch to nigeria will you find buyer for me?like 4a month. And tell dad not to buy bb from anyone oh.
Spam,"U can WIN £100 of Music Gift Vouchers every week starting NOW Txt the word DRAW to 87066 TsCs www.ldew.com SkillGame,1Winaweek, age16.150ppermessSubscription"
Not Spam,I thk 50 shd be ok he said plus minus 10.. Did ü leave a line in between paragraphs?
Spam,Ur ringtone service has changed! 25 Free credits! Go to club4mobiles.com to choose content now! Stop? txt CLUB STOP to 87070. 150p/wk Club4 PO Box1146 MK45 2WT
Not Spam,No prob. I will send to your email.
Spam,"Hi, the SEXYCHAT girls are waiting for you to text them. Text now for a great night chatting. send STOP to stop this service"
Spam,Hope you enjoyed your new content. text stop to 61610 to unsubscribe. help:08712400602450p Provided by tones2you.co.uk
Spam,Great NEW Offer - DOUBLE Mins & DOUBLE Txt on best Orange tariffs AND get latest camera phones 4 FREE! Call MobileUpd8 free on 08000839402 NOW! or 2stoptxt T&Cs
Spam,Congratulations ur awarded either £500 of CD gift vouchers & Free entry 2 our £100 weekly draw txt MUSIC to 87066 TnCs www.Ldew.com 1 win150ppmx3age16
Spam,URGENT This is our 2nd attempt to contact U. Your £900 prize from YESTERDAY is still awaiting collection. To claim CALL NOW 09061702893. ACL03530150PM
Not Spam,"Sorry light turned green, I meant another friend wanted  &lt;#&gt;  worth but he may not be around"
Spam,Santa calling! Would your little ones like a call from Santa Xmas Eve? Call 09077818151 to book you time. Calls1.50ppm last 3mins 30s T&C www.santacalling.com
Not Spam,I dunno they close oredi not... Ü v ma fan...
Not Spam,Convey my regards to him
Spam,"500 New Mobiles from 2004, MUST GO! Txt: NOKIA to No: 89545 & collect yours today!From ONLY £1 www.4-tc.biz 2optout 087187262701.50gbp/mtmsg18 TXTAUCTION"
Spam,URGENT! Your Mobile number has been awarded with a £2000 Bonus Caller Prize. Call 09058095201 from land line. Valid 12hrs only
Spam,Sunshine Quiz Wkly Q! Win a top Sony DVD player if u know which country the Algarve is in? Txt ansr to 82277. £1.50 SP:Tyrone
Spam,"Free entry to the gr8prizes wkly comp 4 a chance to win the latest Nokia 8800, PSP or £250 cash every wk.TXT GREAT to 80878 http//www.gr8prizes.com 08715705022"
Spam,"Congratulations! Thanks to a good friend U have WON the £2,000 Xmas prize. 2 claim is easy, just call 08718726971 NOW! Only 10p per minute. BT-national-rate."
Spam,"accordingly. I repeat, just text the word ok on your mobile phone and send"
Not Spam,"Sweetheart, hope you are not having that kind of day! Have one with loads of reasons to smile. Biola"
Not Spam,Eh den sat u book e kb liao huh...
Not Spam,Your opinion about me? 1. Over 2. Jada 3. Kusruthi 4. Lovable 5. Silent 6. Spl character 7. Not matured 8. Stylish 9. Simple Pls reply..
Spam,"Win the newest Harry Potter and the Order of the Phoenix (Book 5) reply HARRY, answer 5 questions - chance to be the first among readers!"
Spam,Camera - You are awarded a SiPix Digital Camera! call 09061221066 fromm landline. Delivery within 28 days.
Not Spam,Dnt worry...use ice pieces in a cloth pack.also take 2 tablets.
Not Spam,K..give back my thanks.
Spam,PRIVATE! Your 2003 Account Statement for shows 800 un-redeemed S. I. M. points. Call 08715203652 Identifier Code: 42810 Expires 29/10/0
Not Spam,I was at bugis juz now wat... But now i'm walking home oredi... Ü so late then reply... I oso saw a top dat i like but din buy... Where r ü now?
Not Spam,"Gumby's has a special where a  &lt;#&gt; "" cheese pizza is $2 so I know what we're doin tonight"
Spam,"LookAtMe!: Thanks for your purchase of a video clip from LookAtMe!, you've been charged 35p. Think you can do better? Why not send a video in a MMSto 32323."
Not Spam,Thanks for this hope you had a good day today
Not Spam,"We're all getting worried over here, derek and taylor have already assumed the worst"
Spam,You are a winner U have been specially selected 2 receive £1000 cash or a 4* holiday (flights inc) speak to a live operator 2 claim 0871277810810
Spam,Good Luck! Draw takes place 28th Feb 06. Good Luck! For removal send STOP to 87239 customer services 08708034412
Not Spam,"Same here, but I consider walls and bunkers and shit important just because I never play on peaceful but I guess your place is high enough that it don't matter"
Not Spam,"Can you tell Shola to please go to college of medicine and visit the academic department, tell the academic secretary what the current situation is and ask if she can transfer there. She should ask someone to check Sagamu for the same thing and lautech. Its vital she completes her medical education in Nigeria. Its less expensive much less expensive. Unless she will be getting citizen rates in new zealand."
Spam,SplashMobile: Choose from 1000s of gr8 tones each wk! This is a subscrition service with weekly tones costing 300p. U have one credit - kick back and ENJOY
Spam,Had your mobile 10 mths? Update to latest Orange camera/video phones for FREE. Save £s with Free texts/weekend calls. Text YES for a callback orno to opt out
Spam,Todays Voda numbers ending 7548 are selected to receive a $350 award. If you have a match please call 08712300220 quoting claim code 4041 standard rates app
Not Spam,Good Morning my Dear Shijutta........... Have a great &amp; successful day.
Spam,Customer service annoncement. You have a New Years delivery waiting for you. Please call 07046744435 now to arrange delivery
Spam,Message Important information for O2 user. Today is your lucky day! 2 find out why log onto http://www.urawinner.com there is a fantastic surprise awaiting you
Spam,"You are guaranteed the latest Nokia Phone, a 40GB iPod MP3 player or a £500 prize! Txt word: COLLECT to No: 83355! IBHltd LdnW15H 150p/Mtmsgrcvd18+"
Not Spam,Dude ive been seeing a lotta corvettes lately
Spam,CALL 09090900040 & LISTEN TO EXTREME DIRTY LIVE CHAT GOING ON IN THE OFFICE RIGHT NOW TOTAL PRIVACY NO ONE KNOWS YOUR [sic] LISTENING 60P MIN 24/7MP 0870753331018+
Spam,You will be receiving this week's Triple Echo ringtone shortly. Enjoy it!
Spam,Well done ENGLAND! Get the official poly ringtone or colour flag on yer mobile! text TONE or FLAG to 84199 NOW! Opt-out txt ENG STOP. Box39822 W111WX £1.50
Spam,"Hi babe its Chloe, how r u? I was smashed on saturday night, it was great! How was your weekend? U been missing me? SP visionsms.com Text stop to stop 150p/text"
Spam,"Do you realize that in about 40 years, we'll have thousands of old ladies running around with tattoos?"
Spam,I don't know u and u don't know me. Send CHAT to 86688 now and let's find each other! Only 150p/Msg rcvd. HG/Suite342/2Lands/Row/W1J6HL LDN. 18 years or over.
Not Spam,"Yes obviously, but you are the eggs-pert and the potato head… Speak soon!"
Not Spam,Oh k.k..where did you take test?
Spam,You have WON a guaranteed £1000 cash or a £2000 prize. To claim yr prize call our customer service representative on 08714712379 between 10am-7pm Cost 10p
Not Spam,"It's not that you make me cry. It's just that when all our stuff happens on top of everything else, it pushes me over the edge. You don't underdtand how often i cry over my sorry, sorry life."
Not Spam,"OH YEAH,AND HAV A GREAT TIME IN NEWQUAY-SEND ME A POSTCARD !1 LOOK AFTER ALL THE GIRLS WHILE IM GONE(U KNOW THE 1IM TALKIN BOUT!)xx"
Spam,We tried to contact you re your reply to our offer of a Video Handset? 750 anytime any networks mins? UNLIMITED TEXT? Camcorder? Reply or call 08000930705 NOW
Spam,todays vodafone numbers ending with 0089(my last four digits) are selected to received a £350 award. If your number matches please call 09063442151 to claim your £350 award
Not Spam,Our ride equally uneventful - not too many of those pesky cyclists around at that time of night ;).
Spam,You have an important customer service announcement. Call FREEPHONE 0800 542 0825 now!
Not Spam,Joy's father is John. Then John is the ____ of Joy's father. If u ans ths you hav  &lt;#&gt;  IQ. Tis s IAS question try to answer.
Not Spam,Ladies first and genus second k .
Not Spam,HI ITS KATE CAN U GIVE ME A RING ASAP XXX
Not Spam,I.ll post her out l8r. In class
Spam,Double your mins & txts on Orange or 1/2 price linerental - Motorola and SonyEricsson with B/Tooth FREE-Nokia FREE Call MobileUpd8 on 08000839402 or2optout/HV9D
Not Spam,So when do you wanna gym?
Spam,88066 FROM 88066 LOST 3POUND HELP
Spam,"URGENT! Last weekend's draw shows that you have won £1000 cash or a Spanish holiday! CALL NOW 09050000332 to claim. T&C: RSTM, SW7 3SS. 150ppm"
Not Spam,"I think we're going to finn's now, come"
Spam,"Orange brings you ringtones from all time Chart Heroes, with a free hit each week! Go to Ringtones & Pics on wap. To stop receiving these tips reply STOP."
Spam,"Fantasy Football is back on your TV. Go to Sky Gamestar on Sky Active and play £250k Dream Team. Scoring starts on Saturday, so register now!SKY OPT OUT to 88088"
Not Spam,Yeah right! I'll bring my tape measure fri!
Spam,Ur cash-balance is currently 500 pounds - to maximize ur cash-in now send CASH to 86688 only 150p/msg. CC: 08708800282 HG/Suite342/2Lands Row/W1J6HL
Not Spam,Thank god they are in bed!
Not Spam,"Aiyo... Her lesson so early... I'm still sleepin, haha... Okie, u go home liao den confirm w me lor..."
Not Spam,No she didnt. I will search online and let you know.
Spam,"U were outbid by simonwatson5120 on the Shinco DVD Plyr. 2 bid again, visit sms. ac/smsrewards 2 end bid notifications, reply END OUT"
Spam,"our mobile number has won £5000, to claim calls us back or ring the claims hot line on 09050005321."
Not Spam,Let there be snow. Let there be snow. This kind of weather brings ppl together so friendships can grow.
Spam,U have a secret admirer who is looking 2 make contact with U-find out who they R*reveal who thinks UR so special-call on 09058094594
Spam,Email AlertFrom: Jeri StewartSize: 2KBSubject: Low-cost prescripiton drvgsTo listen to email call 123
Not Spam,Does daddy have a bb now.
Not Spam,No no. I will check all rooms befor activities
Spam,"Goal! Arsenal 4 (Henry, 7 v Liverpool 2 Henry scores with a simple shot from 6 yards from a pass by Bergkamp to give Arsenal a 2 goal margin after 78 mins."
Spam,TheMob>Yo yo yo-Here comes a new selection of hot downloads for our members to get for FREE! Just click & open the next link sent to ur fone...
Not Spam,Yo dude guess who just got arrested the other day
Spam,Show ur colours! Euro 2004 2-4-1 Offer! Get an England Flag & 3Lions tone on ur phone! Click on the following service message for info!
Spam,"This is the 2nd time we have tried 2 contact u. U have won the 750 Pound prize. 2 claim is easy, call 08712101358 NOW! Only 10p per min. BT-national-rate"
Spam,We tried to contact you re your reply to our offer of a Video Phone 750 anytime any network mins Half Price Line Rental Camcorder Reply or call 08000930705
Not Spam,How u doin baby girl ?? hope u are okay every time I call ure phone is off! I miss u get in touch
Not Spam,"Mon okie lor... Haha, best is cheap n gd food la, ex oso okie... Depends on whether wana eat western or chinese food... Den which u prefer..."
Spam,"Free msg. Sorry, a service you ordered from 81303 could not be delivered as you do not have sufficient credit. Please top up to receive the service."
Not Spam,Ü come lt 25 n pass to me lar
Spam,Want 2 get laid tonight? Want real Dogging locations sent direct 2 ur mob? Join the UK's largest Dogging Network bt Txting GRAVEL to 69888! Nt. ec2a. 31p.msg@150p
Not Spam,I liked your new house
Not Spam,Oh god..taken the teeth?is it paining
Not Spam,How have your little darlings been so far this week? Need a coffee run tomo?Can't believe it's that time of week already …
Not Spam,somewhere out there beneath the pale moon light someone think in of u some where out there where dreams come true... goodnite &amp; sweet dreams
Spam,We tried to call you re your reply to our sms for a video mobile 750 mins UNLIMITED TEXT free camcorder Reply or call now 08000930705 Del Thurs
Spam,"Urgent Urgent! We have 800 FREE flights to Europe to give away, call B4 10th Sept & take a friend 4 FREE. Call now to claim on 09050000555. BA128NNFWFLY150ppm"
Spam,"Want to funk up ur fone with a weekly new tone reply TONES2U 2 this text. www.ringtones.co.uk, the original n best. Tones 3GBP network operator rates apply"
Spam,"YOUR CHANCE TO BE ON A REALITY FANTASY SHOW call now = 08707509020 Just 20p per min NTT Ltd, PO Box 1327 Croydon CR9 5WB 0870 is a national = rate call."
Spam,Congrats! Nokia 3650 video camera phone is your Call 09066382422 Calls cost 150ppm Ave call 3mins vary from mobiles 16+ Close 300603 post BCM4284 Ldn WC1N3XX
Not Spam,"Sorry my roommates took forever, it ok if I come by now?"
Not Spam,Were somewhere on Fredericksburg
Spam,Guess who am I?This is the first time I created a web page WWW.ASJESUS.COM read all I wrote. I'm waiting for your opinions. I want to be your friend 1/1
Not Spam,I realise you are a busy guy and i'm trying not to be a bother. I have to get some exams outta the way and then try the cars. Do have a gr8 day
Spam,U’ve Bin Awarded £50 to Play 4 Instant Cash. Call 08715203028 To Claim. EVERY 9th Player Wins Min £50-£500. OptOut 08718727870
Not Spam,"Short But Cute: ""Be a good person, but dont try to prove it.."" .Gud noon...."
Not Spam,Hai priya are you right. What doctor said pa. Where are you.
Spam,"You are being contacted by our dating service by someone you know! To find out who it is, call from a land line 09050000878. PoBox45W2TG150P"
Spam,"Customer service announcement. We recently tried to make a delivery to you but were unable to do so, please call 07090298926 to re-schedule. Ref:9307622"
Not Spam,Yeah get the unlimited
Not Spam,K..k..any special today?
Spam,U have a secret admirer. REVEAL who thinks U R So special. Call 09065174042. To opt out Reply REVEAL STOP. 1.50 per msg recd. Cust care 07821230901
Not Spam,"Okies... I'll go yan jiu too... We can skip ard oso, go cine den go mrt one, blah blah blah..."
Not Spam,"My fri ah... Okie lor,goin 4 my drivin den go shoppin after tt..."
Not Spam,It only does simple arithmetic not percentages.
Not Spam,"The sign of maturity is not when we start saying big things.. But actually it is, when we start understanding small things... *HAVE A NICE EVENING* BSLVYL"
Not Spam,"Just wondering, the others just took off"
Spam,"Latest Nokia Mobile or iPOD MP3 Player +£400 proze GUARANTEED! Reply with: WIN to 83355 now! Norcorp Ltd.£1,50/Mtmsgrcvd18+"
Spam,"Urgent! Please call 09066612661 from your landline, your complimentary 4* Lux Costa Del Sol holiday or £1000 CASH await collection. ppm 150 SAE T&Cs James 28, EH74RR"
Spam,"Free-message: Jamster!Get the crazy frog sound now! For poly text MAD1, for real text MAD2 to 88888. 6 crazy sounds for just 3 GBP/week! 16+only! T&C's apply"
Not Spam,Ball is moving a lot.will spin in last :)so very difficult to bat:)
Spam,Great NEW Offer - DOUBLE Mins & DOUBLE Txt on best Orange tariffs AND get latest camera phones 4 FREE! Call MobileUpd8 free on 08000839402 NOW! or 2stoptxt T&Cs
Spam,* FREE* POLYPHONIC RINGTONE Text SUPER to 87131 to get your FREE POLY TONE of the week now! 16 SN PoBox202 NR31 7ZS subscription 450pw
Spam,"Win the newest “Harry Potter and the Order of the Phoenix (Book 5) reply HARRY, answer 5 questions - chance to be the first among readers!"
Spam,74355 XMAS iscoming & ur awarded either £500 CD gift vouchers & free entry 2 r £100 weekly draw txt MUSIC to 87066 TnC
Not Spam,U calling me right? Call my hand phone...
Not Spam,And do you have any one that can teach me how to ship cars.
Not Spam,Pls confirm the time to collect the cheque.
Not Spam,"Goodmorning, today i am late for 2hrs. Because of back pain."
Spam,WIN URGENT! Your mobile number has been awarded with a £2000 prize GUARANTEED call 09061790121 from land line. claim 3030 valid 12hrs only 150ppm
Not Spam,This girl does not stay in bed. This girl doesn't need recovery time. Id rather pass out while having fun then be cooped up in bed
Not Spam,How was txting and driving
Spam,"Congratulations - Thanks to a good friend U have WON the £2,000 Xmas prize. 2 claim is easy, just call 08712103738 NOW! Only 10p per minute. BT-national-rate"
Not Spam,Send his number and give reply tomorrow morning for why you said that to him like that ok
Spam,Urgent! Please call 09061743811 from landline. Your ABTA complimentary 4* Tenerife Holiday or £5000 cash await collection SAE T&Cs Box 326 CW25WX 150ppm
Not Spam,In meeting da. I will call you
Not Spam,Aiyo u so poor thing... Then u dun wan 2 eat? U bathe already?
Not Spam,Do u hav any frnd by name ashwini in ur college?
Spam,FreeMsg:Feelin kinda lnly hope u like 2 keep me company! Jst got a cam moby wanna c my pic?Txt or reply DATE to 82242 Msg150p 2rcv Hlp 08712317606 stop to 82242
Spam,"Twinks, bears, scallies, skins and jocks are calling now. Don't miss the weekend's fun. Call 08712466669 at 10p/min. 2 stop texts call 08712460324(nat rate)"
Not Spam,I dun believe u. I thk u told him.
Spam,Dear Dave this is your final notice to collect your 4* Tenerife Holiday or #5000 CASH award! Call 09061743806 from landline. TCs SAE Box326 CW25WX 150ppm
Spam,"This is the 2nd time we have tried 2 contact u. U have won the 750 Pound prize. 2 claim is easy, call 08712101358 NOW! Only 10p per min. BT-national-rate"
Not Spam,Cuz ibored. And don wanna study
Spam,You have won a guaranteed £200 award or even £1000 cashto claim UR award call free on 08000407165 (18+) 2 stop getstop on 88222 PHP. RG21 4JX
Spam,December only! Had your mobile 11mths+? You are entitled to update to the latest colour camera mobile for Free! Call The Mobile Update Co FREE on 08002986906
Not Spam,"Erm … ill pick you up at about 6.45pm. That'll give enough time to get there, park and that."
Not Spam,"Sorry, I'll call you  later. I am in meeting sir."
Not Spam,Its too late:)but its k.wish you the same.
Spam,"For ur chance to win a £250 wkly shopping spree TXT: SHOP to 80878. T's&C's www.txt-2-shop.com custcare 08715705022, 1x150p/wk"
Spam,"URGENT! Your Mobile No. was awarded £2000 Bonus Caller Prize on 5/9/03 This is our final try to contact U! Call from Landline 09064019788 BOX42WR29C, 150PPM"
Not Spam,Hi. Happy New Year. I dont mean to intrude but can you pls let me know how much tuition you paid last semester and how much this semester is. Thanks
Not Spam,"Its so common hearin How r u? Wat r u doing? How was ur day? So let me ask u something different. Did u smile today? If not, do it now.... Gud evng."
Spam,RGENT! This is the 2nd attempt to contact U!U have WON £1250 CALL 09071512433 b4 050703 T&CsBCM4235WC1N3XX. callcost 150ppm mobilesvary. max£7. 50
Spam,"We know someone who you know that fancies you. Call 09058097218 to find out who. POBox 6, LS15HB 150p"
Spam,Double Mins & Double Txt & 1/2 price Linerental on Latest Orange Bluetooth mobiles. Call MobileUpd8 for the very latest offers. 08000839402 or call2optout/LF56
Spam,Money i have won wining number 946 wot do i do next
Spam,"You are a £1000 winner or Guaranteed Caller Prize, this is our Final attempt to contact you! To Claim Call 09071517866 Now! 150ppmPOBox10183BhamB64XE"
Spam,"Did you hear about the new ""Divorce Barbie""? It comes with all of Ken's stuff!"
Not Spam,I wud never mind if u dont miss me or if u dont need me.. But u wil really hurt me wen u need me &amp; u dont tell me......... Take care:-)
Not Spam,Ok lor...
Not Spam,I emailed yifeng my part oredi.. Can ü get it fr him..
Spam,Send a logo 2 ur lover - 2 names joined by a heart. Txt LOVE NAME1 NAME2 MOBNO eg LOVE ADAM EVE 07123456789 to 87077 Yahoo! POBox36504W45WQ TxtNO 4 no ads 150p.
Not Spam,Dear where you will be when i reach there
Not Spam,Oooh bed ridden ey? What are YOU thinking of?
Not Spam,I've reached home n i bathe liao... U can call me now...
Not Spam,Mathews or tait or edwards or anderson
Spam,"Last Chance! Claim ur £150 worth of discount vouchers today! Text SHOP to 85023 now! SavaMob, offers mobile! T Cs SavaMob POBOX84, M263UZ. £3.00 Sub. 16"
Not Spam,Yup next stop.
Not Spam,Webpage s not available!
Spam,HMV BONUS SPECIAL 500 pounds of genuine HMV vouchers to be won. Just answer 4 easy questions. Play Now! Send HMV to 86688 More info:www.100percent-real.com
Not Spam,Except theres a chick with huge boobs.
Not Spam,Already one guy loving you:-.
Spam,Had your mobile 11 months or more? U R entitled to Update to the latest colour mobiles with camera for Free! Call The Mobile Update Co FREE on 08002986030
Not Spam,I will see in half an hour
Not Spam,Are you there in room.
Not Spam,Got it! It looks scrumptious... daddy wants to eat you all night long!
Not Spam,I'm going for bath will msg you next  &lt;#&gt;  min..
Spam,Panasonic & BluetoothHdset FREE. Nokia FREE. Motorola FREE & DoubleMins & DoubleTxt on Orange contract. Call MobileUpd8 on 08000839402 or call 2optout
Not Spam,Yo you around? A friend of mine's lookin to pick up later tonight
Spam,XCLUSIVE@CLUBSAISAI 2MOROW 28/5 SOIREE SPECIALE ZOUK WITH NICHOLS FROM PARIS.FREE ROSES 2 ALL LADIES !!! info: 07946746291/07880867867
Spam,"SMS. ac Blind Date 4U!: Rodds1 is 21/m from Aberdeen, United Kingdom. Check Him out http://img. sms. ac/W/icmb3cktz8r7!-4 no Blind Dates send HIDE"
Spam,Todays Voda numbers ending 5226 are selected to receive a ?350 award. If you hava a match please call 08712300220 quoting claim code 1131 standard rates app
Spam,Do you want a New Nokia 3510i Colour Phone Delivered Tomorrow? With 200 FREE minutes to any mobile + 100 FREE text + FREE camcorder Reply or Call 08000930705
Not Spam,"I call you later, don't have network. If urgnt, sms me."
Spam,"Urgent! call 09066612661 from landline. Your complementary 4* Tenerife Holiday or £10,000 cash await collection SAE T&Cs PO Box 3 WA14 2PX 150ppm 18+ Sender: Hol Offer"
Not Spam,I cant pick the phone right now. Pls send a message
Not Spam,"Just dropped em off, omw back now"
