Category,Message
Not Spam,"It,,s a taxt massage....tie-pos argh ok! Lool!"
Not Spam,Oh...i asked for fun. Haha...take care. ü
Not Spam,Oh yah... We never cancel leh... Haha
Spam,"URGENT! You have won a 1 week FREE membership in our £100,000 Prize Jackpot! Txt the word: CLAIM to No: 81010 T&C www.dbuk.net LCCLTD POBOX 4403LDNW1A7RW18"
Not Spam,Oh Howda gud gud.. Mathe en samachara chikku:-)
Spam,"Urgent UR awarded a complimentary trip to EuroDisinc Trav, Aco&Entry41 Or £1000. To claim txt DIS to 87121 18+6*£1.50(moreFrmMob. ShrAcomOrSglSuplt)10, LS1 3AJ"
Spam,Get a FREE mobile video player FREE movie. To collect text GO to 89105. Its free! Extra films can be ordered t's and c's apply. 18 yrs only
Spam,PRIVATE! Your 2004 Account Statement for 078498****7 shows 786 unredeemed Bonus Points. To claim call 08719180219 Identifier Code: 45239 Expires 06.05.05
Spam,"For your chance to WIN a FREE Bluetooth Headset then simply reply back with ""ADP"""
Spam,"Eerie Nokia tones 4u, rply TONE TITLE to 8007 eg TONE DRACULA to 8007 Titles: GHOST, ADDAMSFA, MUNSTERS, EXORCIST, TWILIGHT www.getzed.co.uk POBox36504W45WQ 150p"
Spam,Don't b floppy... b snappy & happy! Only gay chat service with photo upload call 08718730666 (10p/min). 2 stop our texts call 08712460324
Spam,FROM 88066 LOST £12 HELP
Spam,"Welcome to UK-mobile-date this msg is FREE giving you free calling to 08719839835. Future mgs billed at 150p daily. To cancel send ""go stop"" to 89123"
Not Spam,Yo guess what I just dropped
Not Spam,My sis is catching e show in e afternoon so i'm not watching w her. So c u wan 2 watch today or tmr lor.
Spam,"For ur chance to win a £250 wkly shopping spree TXT: SHOP to 80878. T's&C's www.txt-2-shop.com custcare 08715705022, 1x150p/wk"
Not Spam,"Arngd marriage is while u r walkin unfortuntly a snake bites u. bt love marriage is dancing in frnt of d snake &amp; sayin Bite me, bite me."
Spam,"For ur chance to win a £250 cash every wk TXT: ACTION to 80608. T's&C's www.movietrivia.tv custcare 08712405022, 1x150p/wk."
Spam,"HOT LIVE FANTASIES call now 08707500020 Just 20p per min NTT Ltd, PO Box 1327 Croydon CR9 5WB 0870 is a national rate call"
Not Spam,Is toshiba portege m100 gd?
Spam,Reminder: You have not downloaded the content you have already paid for. Goto http://doit. mymoby. tv/ to collect your content.
Not Spam,U really pig leh sleep so much. My dad wake me up at 10 smth 2 eat lunch today.
Spam,Sorry! U can not unsubscribe yet. THE MOB offer package has a min term of 54 weeks> pls resubmit request after expiry. Reply THEMOB HELP 4 more info
Spam,25p 4 alfie Moon's Children in need song on ur mob. Tell ur m8s. Txt Tone charity to 8007 for Nokias or Poly charity for polys: zed 08701417012 profit 2 charity.
Not Spam,I've been barred from all B and Q stores for life!?This twat in orange dungerees came up to me and asked if I wanted decking? So I got the first punch in!!
Not Spam,Hey... What time is your driving on fri? We go for evaluation on fri?
Not Spam,You've already got a flaky parent. It'snot supposed to be the child's job to support the parent...not until they're The Ride age anyway. I'm supposed to be there to support you. And now i've hurt you. unintentional. But hurt nonetheless.
Not Spam,Your opinion about me? 1. Over 2. Jada 3. Kusruthi 4. Lovable 5. Silent 6. Spl character 7. Not matured 8. Stylish 9. Simple Pls reply..
Spam,URGENT! We are trying to contact you. Last weekends draw shows that you have won a £900 prize GUARANTEED. Call 09061701851. Claim code K61. Valid 12hours only
Spam,"YOU VE WON! Your 4* Costa Del Sol Holiday or £5000 await collection. Call 09050090044 Now toClaim. SAE, TC s, POBox334, Stockport, SK38xh, Cost£1.50/pm, Max10mins"
Not Spam,That seems unnecessarily affectionate
Spam,Your weekly Cool-Mob tones are ready to download !This weeks new Tones include: 1) Crazy Frog-AXEL F>>> 2) Akon-Lonely>>> 3) Black Eyed-Dont P >>>More info in n
Not Spam,"Great. I'm in church now, will holla when i get out"
Spam,Camera - You are awarded a SiPix Digital Camera! call 09061221066 fromm landline. Delivery within 28 days
Spam,"FreeMSG You have been awarded a FREE mini DIGITAL CAMERA, just reply SNAP to collect your prize! (quizclub Opt out? Stop 80122300p/wk SP:RWM Ph:08704050406)"
Not Spam,So i'm doing a list of buyers.
Spam,FreeMsg: Txt: CALL to No: 86888 & claim your reward of 3 hours talk time to use from your phone now! Subscribe6GBP/mnth inc 3hrs 16 stop?txtStop
Spam,Boltblue tones for 150p Reply POLY# or MONO# eg POLY3 1. Cha Cha Slide 2. Yeah 3. Slow Jamz 6. Toxic 8. Come With Me or STOP 4 more tones txt MORE
Spam,goldviking (29/M) is inviting you to be his friend. Reply YES-762 or NO-762 See him: www.SMS.ac/u/goldviking STOP? Send STOP FRND to 62468
Spam,Reply to win £100 weekly! Where will the 2006 FIFA World Cup be held? Send STOP to 87239 to end service
Spam,Had your mobile 11mths ? Update for FREE to Oranges latest colour camera mobiles & unlimited weekend calls. Call Mobile Upd8 on freefone 08000839402 or 2StopTx
Not Spam,Mmm so yummy babe ... Nice jolt to the suzy
Spam,money!!! you r a lucky winner ! 2 claim your prize text money 2 88600 over £1million to give away ! ppt150x3+normal text rate box403 w1t1jy
Spam,PRIVATE! Your 2003 Account Statement for 07753741225 shows 800 un-redeemed S. I. M. points. Call 08715203677 Identifier Code: 42478 Expires 24/10/04
Not Spam,Now? I'm going out 4 dinner soon..
Not Spam,"My planning usually stops at ""find hella weed, smoke hella weed"""
Not Spam,"Aight, I'll hit you up when I get some cash"
Spam,URGENT! We are trying to contact you. Last weekends draw shows that you have won a £900 prize GUARANTEED. Call 09061701939. Claim code S89. Valid 12hrs only
Spam,http//tms. widelive.com/index. wml?id=820554ad0a1705572711&first=true¡C C Ringtone¡
Spam,Sunshine Quiz! Win a super Sony DVD recorder if you canname the capital of Australia? Text MQUIZ to 82277. B
Not Spam,"Like  &lt;#&gt; , same question"
Not Spam,Ok then i will come to ur home after half an hour
Not Spam,Do u noe wat time e place dat sells 4d closes?
Spam,3. You have received your mobile content. Enjoy
Not Spam,We have to pick rayan macleran there.
Not Spam,"Ah, well that confuses things, doesnt it? I thought was friends with now. Maybe i did the wrong thing but i already sort of invited -tho he may not come cos of money."
Spam,You have an important customer service announcement. Call FREEPHONE 0800 542 0825 now!
Spam,"FreeMsg Why haven't you replied to my text? I'm Randy, sexy, female and live local. Luv to hear from u. Netcollex Ltd 08700621170150p per msg reply Stop to end"
Spam,Someonone you know is trying to contact you via our dating service! To find out who it could be call from your mobile or landline 09064015307 BOX334SK38ch
Not Spam,"Jus chillaxin, what up"
Spam,"Got what it takes 2 take part in the WRC Rally in Oz? U can with Lucozade Energy! Text RALLY LE to 61200 (25p), see packs or lucozade.co.uk/wrc & itcould be u!"
Spam,"URGENT!: Your Mobile No. was awarded a £2,000 Bonus Caller Prize on 02/09/03! This is our 2nd attempt to contact YOU! Call 0871-872-9755 BOX95QU"
Spam,Natalja (25/F) is inviting you to be her friend. Reply YES-440 or NO-440 See her: www.SMS.ac/u/nat27081980 STOP? Send STOP FRND to 62468
Not Spam,No he didn't. Spring is coming early yay!
Spam,We currently have a message awaiting your collection. To collect your message just call 08718723815.
Spam,"WIN: We have a winner! Mr. T. Foley won an iPod! More exciting prizes soon, so keep an eye on ur mobile or visit www.win-82050.co.uk"
Not Spam,Great! How is the office today?
Not Spam,I love to give massages. I use lots of baby oil... What is your fave position?
Spam,"REMINDER FROM O2: To get 2.50 pounds free call credit and details of great offers pls reply 2 this text with your valid name, house no and postcode"
Spam,Our brand new mobile music service is now live. The free music player will arrive shortly. Just install on your phone to browse content from the top artists.
Not Spam,Call me when u're done...
Spam,Hi 07734396839 IBH Customer Loyalty Offer: The NEW NOKIA6600 Mobile from ONLY £10 at TXTAUCTION!Txt word:START to No:81151 & get Yours Now!4T&
Not Spam,"Nothing, i got msg frm tht unknown no.."
Spam,"This is the 2nd attempt to contract U, you have won this weeks top prize of either £1000 cash or £200 prize. Just call 09066361921"
Spam,Customer Loyalty Offer:The NEW Nokia6650 Mobile from ONLY £10 at TXTAUCTION! Txt word: START to No: 81151 & get yours Now! 4T&Ctxt TC 150p/MTmsg
Spam,"Loan for any purpose £500 - £75,000. Homeowners + Tenants welcome. Have you been previously refused? We can still help. Call Free 0800 1956669 or text back 'help'"
Not Spam,"Dont give a monkeys wot they think and i certainly don't mind. Any friend of mine&all that! Just don't sleep wiv , that wud be annoyin!"
Not Spam,"The house is on the water with a dock, a boat rolled up with a newscaster who dabbles in jazz flute behind the wheel"
Not Spam,Give one miss from that number please
Not Spam,"Imagine you finally get to sink into that bath after I have put you through your paces, maybe even having you eat me for a while before I left ... But also imagine the feel of that cage on your cock surrounded by the bath water, reminding you always who owns you ... Enjoy, my cuck"
Spam,"ou are guaranteed the latest Nokia Phone, a 40GB iPod MP3 player or a £500 prize! Txt word: COLLECT to No: 83355! IBHltd LdnW15H 150p/Mtmsgrcvd18"
Spam,Guess what! Somebody you know secretly fancies you! Wanna find out who it is? Give us a call on 09065394514 From Landline DATEBox1282EssexCM61XN 150p/min 18
Not Spam,"Yes..but they said its IT.,"
Spam,Valentines Day Special! Win over £1000 in our quiz and take your partner on the trip of a lifetime! Send GO to 83600 now. 150p/msg rcvd. CustCare:08718720201.
Spam,"44 7732584351, Do you want a New Nokia 3510i colour phone DeliveredTomorrow? With 300 free minutes to any mobile + 100 free texts + Free Camcorder reply or call 08000930705."
Not Spam,"Hello, my love. What are you doing? Did you get to that interview today? Are you you happy? Are you being a good boy? Do you think of me?Are you missing me ?"
Spam,"Urgent! Please call 0906346330. Your ABTA complimentary 4* Spanish Holiday or £10,000 cash await collection SAE T&Cs BOX 47 PO19 2EZ 150ppm 18+"
Not Spam,I'm at bruce &amp; fowler now but I'm in my mom's car so I can't park (long story)
Not Spam,Yes:)sura in sun tv.:)lol.
Spam,Save money on wedding lingerie at www.bridal.petticoatdreams.co.uk Choose from a superb selection with national delivery. Brought to you by WeddingFriend
Not Spam,There the size of elephant tablets & u shove um up ur ass!!
Spam,"YOUR CHANCE TO BE ON A REALITY FANTASY SHOW call now = 08707509020 Just 20p per min NTT Ltd, PO Box 1327 Croydon CR9 5WB 0870 is a national = rate call"
Not Spam,Cool. So how come you havent been wined and dined before?
Not Spam,"Customer place, i wil cal u sir."
Not Spam,Can ü send me a copy of da report?
Spam,You have an important customer service announcement from PREMIER. Call FREEPHONE 0800 542 0578 now!
Not Spam,Oh shut it. Omg yesterday I had a dream that I had 2 kids both boys. I was so pissed. Not only about the kids but them being boys. I even told mark in my dream that he was changing diapers cause I'm not getting owed in the face.
Not Spam,"Aight no rush, I'll ask jay"
Not Spam,I got lousy sleep. I kept waking up every 2 hours to see if my cat wanted to come in. I worry about him when its cold :(
Spam,"Get 3 Lions England tone, reply lionm 4 mono or lionp 4 poly. 4 more go 2 www.ringtones.co.uk, the original n best. Tones 3GBP network operator rates apply."
Spam,Do you want 750 anytime any network mins 150 text and a NEW video phone for only five pounds per week call 08000776320 now or reply for delivery Tomorrow
Not Spam,Great. P diddy is my neighbor and comes for toothpaste every morning
Spam,Todays Vodafone numbers ending with 4882 are selected to a receive a £350 award. If your number matches call 09064019014 to receive your £350 award.
Not Spam,Y?WHERE U AT DOGBREATH? ITS JUST SOUNDING LIKE JAN C THATS AL!!!!!!!!!
Not Spam,"I had been hoping i would not have to send you this message. My rent is due and i dont have enough for it. My reserves are completely gone. Its a loan i need and was hoping you could her. The balance is  &lt;#&gt; . Is there a way i could get that from you, till mid march when i hope to pay back."
Spam,"09066362231 URGENT! Your mobile No 07xxxxxxxxx won a £2,000 bonus caller prize on 02/06/03! this is the 2nd attempt to reach YOU! call 09066362231 ASAP!"
Spam,"Loan for any purpose £500 - £75,000. Homeowners + Tenants welcome. Have you been previously refused? We can still help. Call Free 0800 1956669 or text back 'help'"
Not Spam,"Damn, can you make it tonight or do you want to just wait til tomorrow"
Not Spam,Hi Harish's rent has been transfred to ur Acnt.
Spam,YES! The only place in town to meet exciting adult singles is now in the UK. Txt CHAT to 86688 now! 150p/Msg.
Spam,Sunshine Quiz Wkly Q! Win a top Sony DVD player if u know which country Liverpool played in mid week? Txt ansr to 82277. £1.50 SP:Tyrone
Spam,As one of our registered subscribers u can enter the draw 4 a 100 G.B. gift voucher by replying with ENTER. To unsubscribe text STOP
Not Spam,Hey mate. Spoke to the mag people. We‘re on.  the is deliver by the end of the month. Deliver on the 24th sept. Talk later.
Spam,"3 FREE TAROT TEXTS! Find out about your love life now! TRY 3 FOR FREE! Text CHANCE to 85555 16 only! After 3 Free, Msgs £1.50 each"
Not Spam,Thank you baby! I cant wait to taste the real thing...
Spam,from www.Applausestore.com MonthlySubscription@50p/msg max6/month T&CsC web age16 2stop txt stop
Not Spam,Ok. I only ask abt e movie. U wan ktv oso?
Spam,You can donate £2.50 to UNICEF's Asian Tsunami disaster support fund by texting DONATE to 864233. £2.50 will be added to your next bill
Not Spam,"We know TAJ MAHAL as symbol of love. But the other lesser known facts 1. Mumtaz was Shahjahan's 4th wife, out of his 7 wifes. 2. Shahjahan killed Mumtaz's husband to marry her. 3. Mumtaz died in her  &lt;#&gt; th delivery. 4. He then married Mumtaz's sister. Question arises where the Hell is the LOVE?:-| -The Great Hari-"
Not Spam,... Are you in the pub?
Spam,sports fans - get the latest sports news str* 2 ur mobile 1 wk FREE PLUS a FREE TONE Txt SPORT ON to 8007 www.getzed.co.uk 0870141701216+ norm 4txt/120p
Spam,4mths half price Orange line rental & latest camera phones 4 FREE. Had your phone 11mths ? Call MobilesDirect free on 08000938767 to update now! or2stoptxt
Spam,"Hungry gay guys feeling hungry and up 4 it, now. Call 08718730555 just 10p/min. To stop texts call 08712460324 (10p/min)"
Spam,FREE for 1st week! No1 Nokia tone 4 ur mob every week just txt NOKIA to 8007 Get txting and tell ur mates www.getzed.co.uk POBox 36504 W45WQ norm150p/tone 16+
Spam,"Rock yr chik. Get 100's of filthy films &XXX pics on yr phone now. rply FILTH to 69669. Saristar Ltd, E14 9YT 08701752560. 450p per 5 days. Stop2 cancel"
Spam,FreeMsg Today's the day if you are ready! I'm horny & live in your town. I love sex fun & games! Netcollex Ltd 08700621170150p per msg reply Stop to end
Not Spam,Have you got Xmas radio times. If not i will get it now
Not Spam,So what about you. What do you remember
Spam,UR GOING 2 BAHAMAS! CallFREEFONE 08081560665 and speak to a live operator to claim either Bahamas cruise of£2000 CASH 18+only. To opt out txt X to 07786200117
Not Spam,"Sorry, I'll call later"
Not Spam,Anything lar...
Spam,500 free text msgs. Just text ok to 80488 and we'll credit your account
Spam,INTERFLORA - It's not too late to order Interflora flowers for christmas call 0800 505060 to place your order before Midnight tomorrow.
Not Spam,JADE ITS PAUL. Y DIDNT U TXT ME? DO U REMEMBER ME FROM BARMED? I WANT 2 TALK 2 U! TXT ME
Spam,5p 4 alfie Moon's Children in need song on ur mob. Tell ur m8s. Txt Tone charity to 8007 for Nokias or Poly charity for polys: zed 08701417012 profit 2 charity.
Spam,"SMS SERVICES. for your inclusive text credits, pls goto www.comuk.net login= 3qxj9 unsubscribe with STOP, no extra charge. help 08702840625.COMUK. 220-CM2 9AE"
Not Spam,Hi its in durban are you still on this number
Spam,URGENT! This is the 2nd attempt to contact U!U have WON £1000CALL 09071512432 b4 300603t&csBCM4235WC1N3XX.callcost150ppmmobilesvary. max£7. 50
Not Spam,Are you this much buzy
Spam,<Forwarded from 448712404000>Please CALL 08712404000 immediately as there is an urgent message waiting for you.
Spam,You have 1 new message. Please call 08715205273
Spam,PRIVATE! Your 2004 Account Statement for 07742676969 shows 786 unredeemed Bonus Points. To claim call 08719180248 Identifier Code: 45239 Expires
Not Spam,"Sorry, I'll call later"
Spam,"WELL DONE! Your 4* Costa Del Sol Holiday or £5000 await collection. Call 09050090044 Now toClaim. SAE, TCs, POBox334, Stockport, SK38xh, Cost£1.50/pm, Max10mins"
Not Spam,"Not sure yet, still trying to get a hold of him"
Not Spam,Sitting ard nothing to do lor. U leh busy w work?
Not Spam,"Okey doke. I'm at home, but not dressed cos laying around ill! Speak to you later bout times and stuff."
Not Spam,Customer place i will call you
Not Spam,"The affidavit says  &lt;#&gt;  E Twiggs St, division g, courtroom  &lt;#&gt; , &lt;TIME&gt;  AM. I'll double check and text you again tomorrow"
Spam,WIN a year supply of CDs 4 a store of ur choice worth £500 & enter our £100 Weekly draw txt MUSIC to 87066 Ts&Cs www.Ldew.com.subs16+1win150ppmx3
Not Spam,S:)but he had some luck.2 catches put down:)
Spam,"As a valued customer, I am pleased to advise you that following recent review of your Mob No. you are awarded with a £1500 Bonus Prize, call 09066368470"
Not Spam,Ok. I asked for money how far
Spam,Sex up ur mobile with a FREE sexy pic of Jordan! Just text BABE to 88600. Then every wk get a sexy celeb! PocketBabe.co.uk 4 more pics. 16 £3/wk 087016248
Not Spam,Nice.nice.how is it working?
Not Spam,"Sorry, I'll call later"
Spam,"You are guaranteed the latest Nokia Phone, a 40GB iPod MP3 player or a £500 prize! Txt word: COLLECT to No: 83355! IBHltd LdnW15H 150p/Mtmsgrcvd18"
Not Spam,Good Morning plz call me sir
Not Spam,"I don't have anybody's number, I still haven't thought up a tactful way to ask alex"
Not Spam,Then wat r u doing now? Busy wif work?
Spam,December only! Had your mobile 11mths+? You are entitled to update to the latest colour camera mobile for Free! Call The Mobile Update VCo FREE on 08002986906
Not Spam,He said i look pretty wif long hair wat. But i thk he's cutting quite short 4 me leh.
Spam,Moby Pub Quiz.Win a £100 High Street prize if u know who the new Duchess of Cornwall will be? Txt her first name to 82277.unsub STOP £1.50 008704050406 SP Arrow
Not Spam,"Aight, sounds good. When do you want me to come down?"
Not Spam,Have you laid your airtel line to rest?
Spam,Update_Now - 12Mths Half Price Orange line rental: 400mins...Call MobileUpd8 on 08000839402 or call2optout=J5Q
Spam,"Shop till u Drop, IS IT YOU, either 10K, 5K, £500 Cash or £100 Travel voucher, Call now, 09064011000. NTT PO Box CR01327BT fixedline Cost 150ppm mobile vary"
Not Spam,tap & spile at seven. * Is that pub on gas st off broad st by canal. Ok?
Not Spam,I jokin oni lar.. Ü busy then i wun disturb ü.
Not Spam,Dear i have reache room
Not Spam,Am on a train back from northampton so i'm afraid not! I'm staying skyving off today ho ho! Will be around wednesday though. Do you fancy the comedy club this week by the way?
Spam,Call Germany for only 1 pence per minute! Call from a fixed line via access number 0844 861 85 85. No prepayment. Direct access!
Spam,EASTENDERS TV Quiz. What FLOWER does DOT compare herself to? D= VIOLET E= TULIP F= LILY txt D E or F to 84025 NOW 4 chance 2 WIN £100 Cash WKENT/150P16+
Not Spam,You will be in the place of that man
Spam,sexy sexy cum and text me im wet and warm and ready for some porn! u up for some fun? THIS MSG IS FREE RECD MSGS 150P INC VAT 2 CANCEL TEXT STOP
Not Spam,"Wishing you and your family Merry ""X"" mas and HAPPY NEW Year in advance.."
Spam,"Someone U know has asked our dating service 2 contact you! Cant guess who? CALL 09058095107 NOW all will be revealed. POBox 7, S3XY 150p"
Not Spam,"How are you, my Love ? Are you with your brother ? Time to talk english with him ? *grins* Say : Hey Muhommad, Penny says hello from across the sea"
Not Spam,Will do. Was exhausted on train this morning. Too much wine and pie. You sleep well too
Spam,Tone Club: Your subs has now expired 2 re-sub reply MONOC 4 monos or POLYC 4 polys 1 weekly @ 150p per week Txt STOP 2 stop This msg free Stream 0871212025016
Spam,URGENT! Your Mobile number has been awarded with a £2000 prize GUARANTEED. Call 09058094455 from land line. Claim 3030. Valid 12hrs only
Spam,Talk sexy!! Make new friends or fall in love in the worlds most discreet text dating service. Just text VIP to 83110 and see who you could meet.
Not Spam,WHO ARE YOU SEEING?
Not Spam,"Each Moment in a day,has its own value-Morning brings hope,afternoon brings faith,Evening brings luv,Night brings rest,Wish u find them all today.Good Morning"
Not Spam,Jay is snickering and tells me that x is totally fucking up the chords as we speak
Spam,Someone U know has asked our dating service 2 contact you! Cant Guess who? CALL 09058091854 NOW all will be revealed. PO BOX385 M6 6WU
Not Spam,Ok.
Spam,"URGENT, IMPORTANT INFORMATION FOR O2 USER. TODAY IS YOUR LUCKY DAY! 2 FIND OUT WHY LOG ONTO HTTP://WWW.URAWINNER.COM THERE IS A FANTASTIC SURPRISE AWAITING FOR YOU"
Not Spam,Nvm take ur time.
Spam,UR awarded a City Break and could WIN a £200 Summer Shopping spree every WK. Txt STORE to 88039.SkilGme.TsCs087147403231Winawk!Age16+£1.50perWKsub
Not Spam,WE REGRET TO INFORM U THAT THE NHS HAS MADE A MISTAKE.U WERE NEVER ACTUALLY BORN.PLEASE REPORT 2 YOR LOCAL HOSPITAL 2B TERMINATED.WE R SORRY 4 THE INCONVENIENCE
Not Spam,He's in lag. That's just the sad part but we keep in touch thanks to skype
Spam,"Urgent -call 09066649731from Landline. Your complimentary 4* Ibiza Holiday or £10,000 cash await collection SAE T&Cs PO BOX 434 SK3 8WP 150ppm 18+"
Not Spam,Tell your friends what you plan to do on Valentines day @ &lt;URL&gt;
Spam,Had your mobile 11mths ? Update for FREE to Oranges latest colour camera mobiles & unlimited weekend calls. Call Mobile Upd8 on freefone 08000839402 or 2StopTxt
Not Spam,Yes..gauti and sehwag out of odi series.
Spam,1st wk FREE! Gr8 tones str8 2 u each wk. Txt NOKIA ON to 8007 for Classic Nokia tones or HIT ON to 8007 for Polys. Nokia/150p Poly/200p 16+
Not Spam,"I've got  &lt;#&gt; , any way I could pick up?"
Spam,Todays Voda numbers ending with 7634 are selected to receive a £350 reward. If you have a match please call 08712300220 quoting claim code 7684 standard rates apply.
Spam,"URGENT! Your mobile No 07xxxxxxxxx won a £2,000 bonus caller prize on 02/06/03! this is the 2nd attempt to reach YOU! call 09066362231 ASAP! BOX97N7QP, 150PPM"
Spam,Summers finally here! Fancy a chat or flirt with sexy singles in yr area? To get MATCHED up just reply SUMMER now. Free 2 Join. OptOut txt STOP Help08714742804
Spam,This message is free. Welcome to the new & improved Sex & Dogging club! To unsubscribe from this service reply STOP. msgs@150p 18+only
Not Spam,"Nah, Wednesday. When should I bring the mini cheetos bag over?"
Not Spam,Sorry da. I gone mad so many pending works what to do.
Not Spam,"Single line with a big meaning::::: ""Miss anything 4 ur ""Best Life"" but, don't miss ur best life for anything... Gud nyt..."
Spam,URGENT This is our 2nd attempt to contact U. Your £900 prize from YESTERDAY is still awaiting collection. To claim CALL NOW 09061702893
Not Spam,"I'm a guy, browsin is compulsory"
Spam,Here is your discount code RP176781. To stop further messages reply stop. www.regalportfolio.co.uk. Customer Services 08717205546
Spam,You are a winner U have been specially selected 2 receive £1000 cash or a 4* holiday (flights inc) speak to a live operator 2 claim 0871277810810
Not Spam,So that takes away some money worries
Not Spam,Huh but i cant go 2 ur house empty handed right?
Not Spam,Hi ....My engagement has been fixd on  &lt;#&gt; th of next month. I know its really shocking bt....hmm njan vilikkam....t ws al of a sudn;-(.
Spam,"SIX chances to win CASH! From 100 to 20,000 pounds txt> CSH11 and send to 87575. Cost 150p/day, 6days, 16+ TsandCs apply Reply HL 4 info"
Spam,"SMS. ac sun0819 posts HELLO:""You seem cool, wanted to say hi. HI!!!"" Stop? Send STOP to 62468"
Spam,ringtoneking 84484
Not Spam,Now press conference da:)
Spam,"U can WIN £100 of Music Gift Vouchers every week starting NOW Txt the word DRAW to 87066 TsCs www.Idew.com SkillGame, 1Winaweek, age16. 150ppermessSubscription"
Not Spam,"Wn u r hurt by d prsn who s close 2 u, do fight wit dem. Coz somtimes dis fight saves a relation bt being quiet leaves nothin in a relation.. Gud eveB-)"
Spam,"FREE RINGTONE text FIRST to 87131 for a poly or text GET to 87131 for a true tone! Help? 0845 2814032 16 after 1st free, tones are 3x£150pw to e£nd txt stop"
Spam,Dear 0776xxxxxxx U've been invited to XCHAT. This is our final attempt to contact u! Txt CHAT to 86688 150p/MsgrcvdHG/Suite342/2Lands/Row/W1J6HL LDN 18yrs
Not Spam,Back in brum! Thanks for putting us up and keeping us all and happy. See you soon
Spam,"Congrats 2 mobile 3G Videophones R yours. call 09063458130 now! videochat wid ur mates, play java games, Dload polypH music, noline rentl. bx420. ip4. 5we. 150p"
Not Spam,Hey... are you going to quit soon? Xuhui and i working till end of the month
Not Spam,Dai what this da.. Can i send my resume to this id.
Not Spam,Nokia phone is lovly..
Spam,important information 4 orange user . today is your lucky day!2find out why log onto http://www.urawinner.com THERE'S A FANTASTIC SURPRISE AWAITING YOU!
