Category,Message
Spam,Txt: CALL to No: 86888 & claim your reward of 3 hours talk time to use from your phone now! Subscribe6GBP/mnth inc 3hrs 16 stop?txtStop www.gamb.tv
Not Spam,Oh. U must have taken your REAL Valentine out shopping first.
Spam,88800 and 89034 are premium phone services call 08718711108
Not Spam,My friends use to call the same.
Spam,URGENT! Your Mobile number has been awarded with a £2000 prize GUARANTEED. Call 09061790126 from land line. Claim 3030. Valid 12hrs only 150ppm
Not Spam,Hi:)cts employee how are you?
Spam,"Thanks for your Ringtone Order, Reference T91. You will be charged GBP 4 per week. You can unsubscribe at anytime by calling customer services on 09057039994"
Spam,Dear Voucher Holder 2 claim your 1st class airport lounge passes when using Your holiday voucher call 08704439680. When booking quote 1st class x 2
Spam,Guess what! Somebody you know secretly fancies you! Wanna find out who it is? Give us a call on 09065394973 from Landline DATEBox1282EssexCM61XN 150p/min 18
Spam,YOU HAVE WON! As a valued Vodafone customer our computer has picked YOU to win a £150 prize. To collect is easy. Just call 09061743386
Not Spam,I will see in half an hour
Not Spam,Yeah imma come over cause jay wants to do some drugs
Not Spam,"came to look at the flat, seems ok, in his 50s? * Is away alot wiv work. Got woman coming at 6.30 too."
Spam,"tddnewsletter@emc1.co.uk (More games from TheDailyDraw) Dear Helen, Dozens of Free Games - with great prizesWith.."
Not Spam,"I'm in solihull, | do you want anything?"
Spam,"Urgent! call 09066350750 from your landline. Your complimentary 4* Ibiza Holiday or 10,000 cash await collection SAE T&Cs PO BOX 434 SK3 8WP 150 ppm 18+"
Spam,We have new local dates in your area - Lots of new people registered in YOUR AREA. Reply DATE to start now! 18 only www.flirtparty.us REPLYS150
Spam,"TheMob> Check out our newest selection of content, Games, Tones, Gossip, babes and sport, Keep your mobile fit and funky text WAP to 82468"
Not Spam,You are right. Meanwhile how's project twins comin up
Spam,Last chance 2 claim ur £150 worth of discount vouchers-Text YES to 85023 now!SavaMob-member offers mobile T Cs 08717898035. £3.00 Sub. 16 . Remove txt X or STOP
Spam,U have a secret admirer who is looking 2 make contact with U-find out who they R*reveal who thinks UR so special-call on 09058094599
Spam,FREE entry into our £250 weekly comp just send the word ENTER to 84128 NOW. 18 T&C www.textcomp.com cust care 08712405020.
Spam,Ur TONEXS subscription has been renewed and you have been charged £4.50. You can choose 10 more polys this month. www.clubzed.co.uk *BILLING MSG*
Not Spam,Exactly. Anyways how far. Is jide her to study or just visiting
Not Spam,I couldn't say no as he is a dying man and I feel sad for him so I will go and I just wanted you to know I would probably be gone late into your night
Spam,"Fantasy Football is back on your TV. Go to Sky Gamestar on Sky Active and play £250k Dream Team. Scoring starts on Saturday, so register now!SKY OPT OUT to 88088"
Spam,"To review and KEEP the fantastic Nokia N-Gage game deck with Club Nokia, go 2 www.cnupdates.com/newsletter. unsubscribe from alerts reply with the word OUT"
Spam,Not heard from U4 a while. Call 4 rude chat private line 01223585334 to cum. Wan 2C pics of me gettin shagged then text PIX to 8552. 2End send STOP 8552 SAM xxx
Not Spam,Also hi wesley how've you been
Not Spam,I'm okay. Chasing the dream. What's good. What are you doing next.
Spam,"Want to funk up ur fone with a weekly new tone reply TONES2U 2 this text. www.ringtones.co.uk, the original n best. Tones 3GBP network operator rates apply"
Not Spam,"Ok thats cool. Its , just off either raglan rd or edward rd. Behind the cricket ground. Gimme ring when ur closeby see you tuesday."
Not Spam,Hey check it da. I have listed da.
Spam,Bored housewives! Chat n date now! 0871750.77.11! BT-national rate 10p/min only from landlines!
Not Spam,Yar lor... Keep raining non stop... Or u wan 2 go elsewhere?
Not Spam,"Whatever, juliana. Do whatever you want."
Spam,For taking part in our mobile survey yesterday! You can now have 500 texts 2 use however you wish. 2 get txts just send TXT to 80160 T&C www.txt43.com 1.50p
Spam,You have 1 new message. Please call 08718738034.
Not Spam,I though we shd go out n have some fun so bar in town or something – sound ok?
Spam,You have an important customer service announcement from PREMIER.
Not Spam,"No my blankets are sufficient, thx"
Not Spam,Do you know where my lab goggles went
Not Spam,Did you catch the bus ? Are you frying an egg ? Did you make a tea? Are you eating your mom's left over dinner ? Do you feel my Love ?
Spam,Get the official ENGLAND poly ringtone or colour flag on yer mobile for tonights game! Text TONE or FLAG to 84199. Optout txt ENG STOP Box39822 W111WX £1.50
Spam,"Oh my god! I've found your number again! I'm so glad, text me back xafter this msgs cst std ntwk chg £1.50"
Spam,Are you unique enough? Find out from 30th August. www.areyouunique.co.uk
Spam,"Double Mins & 1000 txts on Orange tariffs. Latest Motorola, SonyEricsson & Nokia with Bluetooth FREE! Call MobileUpd8 on 08000839402 or call2optout/HF8"
Not Spam,Well keep in mind I've only got enough gas for one more round trip barring a sudden influx of cash
Not Spam,Thinking of u ;) x
Spam,"Urgent! call 09066350750 from your landline. Your complimentary 4* Ibiza Holiday or 10,000 cash await collection SAE T&Cs PO BOX 434 SK3 8WP 150 ppm 18+"
Spam,Camera - You are awarded a SiPix Digital Camera! call 09061221066 fromm landline. Delivery within 28 days.
Not Spam,Any way where are you and what doing.
Not Spam,Ok set let u noe e details later...
Spam,"complimentary 4 STAR Ibiza Holiday or £10,000 cash needs your URGENT collection. 09066364349 NOW from Landline not to lose out! Box434SK38WP150PPM18+"
Spam,"Double mins and txts 4 6months FREE Bluetooth on Orange. Available on Sony, Nokia Motorola phones. Call MobileUpd8 on 08000839402 or call2optout/N9DX"
Spam,"Bored of speed dating? Try SPEEDCHAT, txt SPEEDCHAT to 80155, if you don't like em txt SWAP and get a new chatter! Chat80155 POBox36504W45WQ 150p/msg rcd 16"
Not Spam,Where you. What happen
Spam,Hello. We need some posh birds and chaps to user trial prods for champneys. Can i put you down? I need your address and dob asap. Ta r
Not Spam,"Cool breeze... Bright sun... Fresh flower... Twittering birds... All these waiting to wish u: ""GOODMORNING &amp; HAVE A NICE DAY"" :)"
Not Spam,Dont talk to him ever ok its my word.
Spam,The current leading bid is 151. To pause this auction send OUT. Customer Care: 08718726270
Spam,Hi I'm sue. I am 20 years old and work as a lapdancer. I love sex. Text me live - I'm i my bedroom now. text SUE to 89555. By TextOperator G2 1DA 150ppmsg 18+
Not Spam,Wylie update: my weed dealer carlos went to freedom and had a class with lunsford
Not Spam,LOL ... No just was busy
Not Spam,Many more happy returns of the day. I wish you happy birthday.
Spam,Dear U've been invited to XCHAT. This is our final attempt to contact u! Txt CHAT to 86688 150p/MsgrcvdHG/Suite342/2Lands/Row/W1J6HL LDN 18 yrs
Not Spam,X2  &lt;#&gt; . Are you going to get that
Not Spam,"Could you not read me, my Love ? I answered you"
Spam,From next month get upto 50% More Calls 4 Ur standard network charge 2 activate Call 9061100010 C Wire3.net 1st4Terms PoBox84 M26 3UZ Cost £1.50 min MobcudB more
Not Spam,"* Was really good to see you the other day dudette, been missing you!"
Not Spam,No. Yes please. Been swimming?
Not Spam,Headin towards busetop
Spam,Congrats! Nokia 3650 video camera phone is your Call 09066382422 Calls cost 150ppm Ave call 3mins vary from mobiles 16+ Close 300603 post BCM4284 Ldn WC1N3XX
Not Spam,"* Was a nice day and, impressively, i was sensible, went home early and now feel fine. Or am i just boring?! When's yours, i can't remember."
Spam,U have won a nokia 6230 plus a free digital camera. This is what u get when u win our FREE auction. To take part send NOKIA to 83383 now. POBOX114/14TCR/W1 16
Not Spam,I'm so in love with you. I'm excited each day i spend with you. You make me so happy.
Spam,I am hot n horny and willing I live local to you - text a reply to hear strt back from me 150p per msg Netcollex LtdHelpDesk: 02085076972 reply Stop to end
Not Spam,HAPPY NEW YEAR MY NO.1 MAN
Spam,YOU ARE CHOSEN TO RECEIVE A £350 AWARD! Pls call claim number 09066364311 to collect your award which you are selected to receive as a valued mobile customer.
Spam,U are subscribed to the best Mobile Content Service in the UK for £3 per 10 days until you send STOP to 82324. Helpline 08706091795
Not Spam,No plm i will come da. On the way.
Not Spam,Huh? 6 also cannot? Then only how many mistakes?
Not Spam,Yay! You better not have told that to 5 other girls either.
Not Spam,Both :) i shoot big loads so get ready!
Spam,Fancy a shag? I do.Interested? sextextuk.com txt XXUK SUZY to 69876. Txts cost 1.50 per msg. TnCs on website. X
Spam,"all the lastest from Stereophonics, Marley, Dizzee Racal, Libertines and The Strokes! Win Nookii games with Flirt!! Click TheMob WAP Bookmark or text WAP to 82468"
Spam,Free Msg: Ringtone!From: http://tms. widelive.com/index. wml?id=1b6a5ecef91ff9*37819&first=true18:0430-JUL-05
Not Spam,I dont have any of your file in my bag..i was in work when you called me.i 'll tell you if i find anything in my room.
Not Spam,Ummma.will call after check in.our life will begin from qatar so pls pray very hard.
Spam,Had your mobile 11 months or more? U R entitled to Update to the latest colour mobiles with camera for Free! Call The Mobile Update Co FREE on 08002986030
Not Spam,"Sorry, I'll call later in meeting."
Spam,FREE UNLIMITED HARDCORE PORN direct 2 your mobile Txt PORN to 69200 & get FREE access for 24 hrs then chrgd@50p per day txt Stop 2exit. This msg is free
Spam,U have a secret admirer who is looking 2 make contact with U-find out who they R*reveal who thinks UR so special-call on 09058094599
Spam,85233 FREE>Ringtone!Reply REAL
Not Spam,Ü log off 4 wat. It's sdryb8i
Not Spam,Only 2% students solved this CAT question in 'xam... 5+3+2= &lt;#&gt;  9+2+4= &lt;#&gt;  8+6+3= &lt;#&gt;  then 7+2+5=????? Tell me the answer if u r brilliant...1thing.i got d answr.
Spam,"Free Msg: get Gnarls Barkleys ""Crazy"" ringtone TOTALLY FREE just reply GO to this message right now!"
Spam,Congratulations ur awarded either a yrs supply of CDs from Virgin Records or a Mystery Gift GUARANTEED Call 09061104283 Ts&Cs www.smsco.net £1.50pm approx 3mins
Spam,Hard LIVE 121 chat just 60p/min. Choose your girl and connect LIVE. Call 09094646899 now! Cheap Chat UK's biggest live service. VU BCM1896WC1N3XX
Not Spam,Stupid.its not possible
Not Spam,"Not much, just some textin'. How bout you?"
Not Spam,Will ü b going to esplanade fr home?
Spam,FREE MSG:We billed your mobile number by mistake from shortcode 83332.Please call 08081263000 to have charges refunded.This call will be free from a BT landline
Spam,"HOT LIVE FANTASIES call now 08707509020 Just 20p per min NTT Ltd, PO Box 1327 Croydon CR9 5WB 0870..k"
Not Spam,I wanted to ask ü to wait 4 me to finish lect. Cos my lect finishes in an hour anyway.
Not Spam,"No idea, I guess we'll work that out an hour after we're supposed to leave since as usual nobody has any interest in figuring shit out before the last second"
Not Spam,"Do you know why god created gap between your fingers..? So that, One who is made for you comes &amp; fills those gaps by holding your hand with LOVE..!"
Spam,You are now unsubscribed all services. Get tons of sexy babes or hunks straight to your phone! go to http://gotbabes.co.uk. No subscriptions.
Spam,Sorry I missed your call let's talk when you have the time. I'm on 07090201529
Not Spam,Where in abj are you serving. Are you staying with dad or alone.
Not Spam,Are you coming to day for class.
Spam,CLAIRE here am havin borin time & am now alone U wanna cum over 2nite? Chat now 09099725823 hope 2 C U Luv CLAIRE xx Calls£1/minmoremobsEMSPOBox45PO139WA
Spam,"You've won tkts to the EURO2004 CUP FINAL or £800 CASH, to collect CALL 09058099801 b4190604, POBOX 7876150ppm"
Spam,4mths half price Orange line rental & latest camera phones 4 FREE. Had your phone 11mths ? Call MobilesDirect free on 08000938767 to update now! or2stoptxt
Spam,Urgent! Please call 09061743810 from landline. Your ABTA complimentary 4* Tenerife Holiday or #5000 cash await collection SAE T&Cs Box 326 CW25WX 150 ppm
Spam,Freemsg: 1-month unlimited free calls! Activate SmartCall Txt: CALL to No: 68866. Subscriptn3gbp/wk unlimited calls Help: 08448714184 Stop?txt stop landlineonly
Not Spam,Good morning. At the repair shop--the ONLY reason i'm up at this hour.
Not Spam,"I'm home, my love ... If your still awake ... *loving kiss*"
Spam,Buy Space Invaders 4 a chance 2 win orig Arcade Game console. Press 0 for Games Arcade (std WAP charge) See o2.co.uk/games 4 Terms + settings. No purchase
Not Spam,Id onluy matters when getting on from offcampus
Not Spam,Hey what's up charles sorry about the late reply.
Not Spam,"I keep seeing weird shit and bein all ""woah"" then realising it's actually reasonable and I'm all ""oh"""
Spam,PRIVATE! Your 2003 Account Statement for 07808247860 shows 800 un-redeemed S. I. M. points. Call 08719899229 Identifier Code: 40411 Expires 06/11/04
Spam,#ERROR!
Not Spam,Slaaaaave ! Where are you ? Must I summon you to me all the time now ? Don't you wish to come to me on your own anymore?
Spam,Ur cash-balance is currently 500 pounds - to maximize ur cash-in now send GO to 86688 only 150p/msg. CC: 08718720201 PO BOX 114/14 TCR/W1
Spam,ree entry in 2 a weekly comp for a chance to win an ipod. Txt POD to 80182 to get entry (std txt rate) T&C's apply 08452810073 for details 18+
Spam,This message is free. Welcome to the new & improved Sex & Dogging club! To unsubscribe from this service reply STOP. msgs@150p 18 only
Spam,"SMS SERVICES. for your inclusive text credits, pls goto www.comuk.net login= 3qxj9 unsubscribe with STOP, no extra charge. help 08702840625.COMUK. 220-CM2 9AE"
Spam,"You can stop further club tones by replying ""STOP MIX"" See my-tone.com/enjoy. html for terms. Club tones cost GBP4.50/week. MFL, PO Box 1146 MK45 2WT (2/3)"
Not Spam,Early bird! Any purchases yet?
Spam,"January Male Sale! Hot Gay chat now cheaper, call 08709222922. National rate from 1.5p/min cheap to 7.8p/min peak! To stop texts call 08712460324 (10p/min)"
Spam,Hi. Customer Loyalty Offer:The NEW Nokia6650 Mobile from ONLY £10 at TXTAUCTION! Txt word: START to No: 81151 & get yours Now! 4T&Ctxt TC 150p/MTmsg
Spam,Not heard from U4 a while. Call 4 rude chat private line 01223585334 to cum. Wan 2C pics of me gettin shagged then text PIX to 8552. 2End send STOP 8552 SAM xxx
Spam,Not heard from U4 a while. Call me now am here all night with just my knickers on. Make me beg for it like U did last time 01223585236 XX Luv Nikiyu4.net
Spam,"Do you ever notice that when you're driving, anyone going slower than you is an idiot and everyone driving faster than you is a maniac?"
Spam,FREE entry into our £250 weekly competition just text the word WIN to 80086 NOW. 18 T&C www.txttowin.co.uk
Spam,Phony £350 award - Todays Voda numbers ending XXXX are selected to receive a £350 award. If you have a match please call 08712300220 quoting claim code 3100 standard rates app
Not Spam,Ha ha - had popped down to the loo when you hello-ed me. Hello!
Spam,No. 1 Nokia Tone 4 ur mob every week! Just txt NOK to 87021. 1st Tone FREE ! so get txtin now and tell ur friends. 150p/tone. 16 reply HL 4info
Not Spam,I accidentally brought em home in the box
Not Spam,Good morning princess! Happy New Year!
Spam,important information 4 orange user 0789xxxxxxx. today is your lucky day!2find out why log onto http://www.urawinner.com THERE'S A FANTASTIC SURPRISE AWAITING YOU!
Not Spam,"Haven't seen my facebook, huh? Lol!"
Not Spam,Hahaha..use your brain dear
Not Spam,Nvm... I'm going to wear my sport shoes anyway... I'm going to be late leh.
Spam,Marvel Mobile Play the official Ultimate Spider-man game (£4.50) on ur mobile right now. Text SPIDER to 83338 for the game & we ll send u a FREE 8Ball wallpaper
Spam,"WIN: We have a winner! Mr. T. Foley won an iPod! More exciting prizes soon, so keep an eye on ur mobile or visit www.win-82050.co.uk"
Spam,Free video camera phones with Half Price line rental for 12 mths and 500 cross ntwk mins 100 txts. Call MobileUpd8 08001950382 or Call2OptOut/674
Spam,Monthly password for wap. mobsi.com is 391784. Use your wap phone not PC.
Not Spam,Its on in engalnd! But telly has decided it won't let me watch it and mia and elliot were kissing! Damn it!
Not Spam,So how's scotland. Hope you are not over showing your JJC tendencies. Take care. Live the dream
Spam,"You have won ?1,000 cash or a ?2,000 prize! To claim, call09050000327. T&C: RSTM, SW7 3SS. 150ppm"
Spam,"SMSSERVICES. for yourinclusive text credits, pls goto www.comuk.net login= 3qxj9 unsubscribe with STOP, no extra charge. help 08702840625.COMUK. 220-CM2 9AE"
Spam,"Text82228>> Get more ringtones, logos and games from www.txt82228.com. Questions: info@txt82228.co.uk"
Not Spam,Ok.
Not Spam,"Aight, I should be there by 8 at the latest, probably closer to 7. Are jay and tyler down or should we just do two trips?"
Not Spam,Otherwise had part time job na-tuition..
Spam,No 1 POLYPHONIC tone 4 ur mob every week! Just txt PT2 to 87575. 1st Tone FREE ! so get txtin now and tell ur friends. 150p/tone. 16 reply HL 4info
Spam,1000's of girls many local 2 u who r virgins 2 this & r ready 2 4fil ur every sexual need. Can u 4fil theirs? text CUTE to 69911(£1.50p. m)
Not Spam,Hi its me you are probably having too much fun to get this message but i thought id txt u cos im bored! and james has been farting at me all night
Not Spam,"No dude, its not fake..my frnds got money, thts y i'm reffering u..if u member wit my mail link, u vl be credited  &lt;#&gt; rs and il be getiing  &lt;#&gt; rs..i can draw my acc wen it is  &lt;#&gt; rs.."
Not Spam,Will be out of class in a few hours. Sorry
Not Spam,Are you this much buzy
Spam,This is the 2nd time we have tried to contact u. U have won the £1450 prize to claim just call 09053750005 b4 310303. T&Cs/stop SMS 08718725756. 140ppm
Spam,"Hi, this is Mandy Sullivan calling from HOTMIX FM...you are chosen to receive £5000.00 in our Easter Prize draw.....Please telephone 09041940223 to claim before 29/03/05 or your prize will be transferred to someone else...."
Spam,18 days to Euro2004 kickoff! U will be kept informed of all the latest news and results daily. Unsubscribe send GET EURO STOP to 83222.
Not Spam,And popping &lt;#&gt; ibuprofens was no help.
Spam,"BangBabes Ur order is on the way. U SHOULD receive a Service Msg 2 download UR content. If U do not, GoTo wap. bangb. tv on UR mobile internet/service menu"
Not Spam,S:)s.nervous  &lt;#&gt; :)
Not Spam,i want to grasp your pretty booty :)
Spam,How about getting in touch with folks waiting for company? Just txt back your NAME and AGE to opt in! Enjoy the community (150p/SMS)
Spam,Jamster! To get your free wallpaper text HEART to 88888 now! T&C apply. 16 only. Need Help? Call 08701213186.
Not Spam,"1.20 that call cost. Which i guess isnt bad. Miss ya, need ya, want ya, love ya"
Spam,Get your garden ready for summer with a FREE selection of summer bulbs and seeds worth £33:50 only with The Scotsman this Saturday. To stop go2 notxt.co.uk
Not Spam,Where are you ? What do you do ? How can you stand to be away from me ? Doesn't your heart ache without me ? Don't you wonder of me ? Don't you crave me ?
Not Spam,Will you be here for food
Not Spam,Don't fret. I'll buy the ovulation test strips and send them to you. You wont get them til like march. Can you send me your postal address.u'll be alright.Okay.
Not Spam,No need for the drug anymore.
Not Spam,Well its not like you actually called someone a punto. That woulda been worse.
Spam,"U can WIN £100 of Music Gift Vouchers every week starting NOW Txt the word DRAW to 87066 TsCs www.Idew.com SkillGame, 1Winaweek, age16. 150ppermessSubscription"
Not Spam,Ok...
Not Spam,Do you like shaking your booty on the dance floor?
Not Spam,Hey i will be really pretty late... You want to go for the lesson first? I will join you. I'm only reaching tp mrt
Spam,"Hack Chat. Get backdoor entry into 121 chat rooms at a fraction of the cost. Reply NEO69 or call 09050280520, to subscribe 25p pm. DPS, Bcm box 8027 Ldn, wc1n3xx"
Not Spam,Hi where you. You in home or calicut?
Spam,Filthy stories and GIRLS waiting for your
Spam,Ur cash-balance is currently 500 pounds - to maximize ur cash-in now send CASH to 86688 only 150p/msg. CC: 08718720201 PO BOX 114/14 TCR/W1
Spam,Get ur 1st RINGTONE FREE NOW! Reply to this msg with TONE. Gr8 TOP 20 tones to your phone every week just £1.50 per wk 2 opt out send STOP 08452810071 16
Spam,"For ur chance to win a £250 cash every wk TXT: ACTION to 80608. T's&C's www.movietrivia.tv custcare 08712405022, 1x150p/wk"
Spam,Free 1st week entry 2 TEXTPOD 4 a chance 2 win 40GB iPod or £250 cash every wk. Txt VPOD to 81303 Ts&Cs www.textpod.net custcare 08712405020.
Not Spam,"Sorry, I'll call later"
Not Spam,"Ok da, i already planned. I wil pick you."
Not Spam,Nah dub but je still buff
Spam,URGENT! Your Mobile number has been awarded with a £2000 prize GUARANTEED. Call 09058094454 from land line. Claim 3030. Valid 12hrs only
Spam,"FreeMsg Hey there darling it's been 3 week's now and no word back! I'd like some fun you up for it still? Tb ok! XxX std chgs to send, £1.50 to rcv"
Spam,"U've been selected to stay in 1 of 250 top British hotels - FOR NOTHING! Holiday valued at £350! Dial 08712300220 to claim - National Rate Call. Bx526, SW73SS"
Not Spam,"Hurry up, I've been weed-deficient for like three days"
Not Spam,"Good FRIENDS CaRE for each Other.. CLoSE Friends UNDERSTaND each Other... and TRUE Friends STaY forever beyond words, beyond time. Gud ni8"
Not Spam,Hi. Hope you had a good day. Have a better night.
Spam,Want the latest Video handset? 750 anytime any network mins? Half price line rental? Reply or call 08000930705 for delivery tomorrow
Spam,Ur cash-balance is currently 500 pounds - to maximize ur cash-in now send COLLECT to 83600 only 150p/msg. CC: 08718720201 PO BOX 114/14 TCR/W1
Not Spam,"I think your mentor is , but not 100 percent sure."
Spam,Thanks for the Vote. Now sing along with the stars with Karaoke on your mobile. For a FREE link just reply with SING now.
Not Spam,Orh i tot u say she now still dun believe.
Spam,"Congrats! 2 mobile 3G Videophones R yours. call 09061744553 now! videochat wid ur mates, play java games, Dload polyH music, noline rentl. bx420. ip4. 5we. 150pm"
Spam,"Sunshine Hols. To claim ur med holiday send a stamped self address envelope to Drinks on Us UK, PO Box 113, Bray, Wicklow, Eire. Quiz Starts Saturday! Unsub Stop"
Spam,"Congratulations! Thanks to a good friend U have WON the £2,000 Xmas prize. 2 claim is easy, just call 08718726978 NOW! Only 10p per minute. BT-national-rate"
Spam,"FreeMsg Hey U, i just got 1 of these video/pic fones, reply WILD to this txt & ill send U my pics, hurry up Im so bored at work xxx (18 150p/rcvd STOP2stop)"
Spam,"Congrats! 1 year special cinema pass for 2 is yours. call 09061209465 now! C Suprman V, Matrix3, StarWars3, etc all 4 FREE! bx420-ip4-5we. 150pm. Dont miss out!"
Spam,FreeMsg: Hey - I'm Buffy. 25 and love to satisfy men. Home alone feeling randy. Reply 2 C my PIX! QlynnBV Help08700621170150p a msg Send stop to stop txts
Spam,100 dating service cal;l 09064012103 box334sk38ch
Spam,SMS AUCTION - A BRAND NEW Nokia 7250 is up 4 auction today! Auction is FREE 2 join & take part! Txt NOKIA to 86021 now! HG/Suite342/2Lands Row/W1J6HL
Not Spam,Alright took the morphine. Back in yo.
Spam,Please CALL 08712402902 immediately as there is an urgent message waiting for you.
Spam,Ringtone Club: Gr8 new polys direct to your mobile every week !
Not Spam,"Ill call u 2mrw at ninish, with my address that icky American freek wont stop callin me 2 bad Jen k eh?"
Spam,"Got what it takes 2 take part in the WRC Rally in Oz? U can with Lucozade Energy! Text RALLY LE to 61200 (25p), see packs or lucozade.co.uk/wrc & itcould be u!"
Spam,"SMS. ac JSco: Energy is high, but u may not know where 2channel it. 2day ur leadership skills r strong. Psychic? Reply ANS w/question. End? Reply END JSCO"
Not Spam,Talk to g and x about that
Spam,"URGENT!! Your 4* Costa Del Sol Holiday or £5000 await collection. Call 09050090044 Now toClaim. SAE, TC s, POBox334, Stockport, SK38xh, Cost£1.50/pm, Max10mins"
Spam,"UpgrdCentre Orange customer, you may now claim your FREE CAMERA PHONE upgrade for your loyalty. Call now on 0207 153 9153. Offer ends 26th July. T&C's apply. Opt-out available"
Not Spam,Nothing just getting msgs by dis name wit different no's..
Spam,Do you want a New Nokia 3510i colour phone DeliveredTomorrow? With 300 free minutes to any mobile + 100 free texts + Free Camcorder reply or call 08000930705
Not Spam,I am going to sleep. I am tired of travel.
Not Spam,Stop calling everyone saying I might have cancer. My throat hurts to talk. I can't be answering everyones calls. If I get one more call I'm not babysitting on Monday
Not Spam,Home so we can always chat
Not Spam,Ok...
Spam,"Ur balance is now £600. Next question: Complete the landmark, Big, A. Bob, B. Barry or C. Ben ?. Text A, B or C to 83738. Good luck!"
Not Spam,HI DARLIN IM MISSIN U HOPE YOU ARE HAVING A GOOD TIME. WHEN ARE U BACK AND WHAT TIME IF U CAN GIVE ME A CALL AT HOME. JESS XX
Spam,You have been specially selected to receive a 2000 pound award! Call 08712402050 BEFORE the lines close. Cost 10ppm. 16+. T&Cs apply. AG Promo
Spam,Urgent Please call 09066612661 from landline. £5000 cash or a luxury 4* Canary Islands Holiday await collection. T&Cs SAE award. 20M12AQ. 150ppm. 16+ “
Not Spam,"Aight, I'm chillin in a friend's room so text me when you're on the way"
