Category,Message
Not Spam,The evo. I just had to download flash. Jealous?
Not Spam,Hi Dear Call me its urgnt. I don't know whats your problem. You don't want to work or if you have any other problem at least tell me. Wating for your reply.
Not Spam,Full heat pa:-) i have applyed oil pa.
Not Spam,Gokila is talking with you aha:)
Not Spam,"Dude u knw also telugu..thts gud..k, gud nyt.."
Spam,"URGENT! Your mobile was awarded a £1,500 Bonus Caller Prize on 27/6/03. Our final attempt 2 contact U! Call 08714714011"
Spam,Your unique user ID is 1172. For removal send STOP to 87239 customer services 08708034412
Spam,"For ur chance to win £250 cash every wk TXT: PLAY to 83370. T's&C's www.music-trivia.net custcare 08715705022, 1x150p/wk."
Spam,Back 2 work 2morro half term over! Can U C me 2nite 4 some sexy passion B4 I have 2 go back? Chat NOW 09099726481 Luv DENA Calls £1/minMobsmoreLKPOBOX177HP51FL
Spam,Free video camera phones with Half Price line rental for 12 mths and 500 cross ntwk mins 100 txts. Call MobileUpd8 08001950382 or Call2OptOut/674&
Not Spam,K still are you loving me.
Spam,Free msg: Single? Find a partner in your area! 1000s of real people are waiting to chat now!Send CHAT to 62220Cncl send STOPCS 08717890890£1.50 per msg
Not Spam,I uploaded mine to Facebook
Not Spam,"Love isn't a decision, it's a feeling. If we could decide who to love, then, life would be much simpler, but then less magical"
Spam,Get your garden ready for summer with a FREE selection of summer bulbs and seeds worth £33:50 only with The Scotsman this Saturday. To stop go2 notxt.co.uk
Spam,A link to your picture has been sent. You can also use http://alto18.co.uk/wave/wave.asp?o=44345
Not Spam,Its a part of checking IQ
Spam,Call 09095350301 and send our girls into erotic ecstacy. Just 60p/min. To stop texts call 08712460324 (nat rate)
Not Spam,Thanx...
Spam,Valentines Day Special! Win over £1000 in our quiz and take your partner on the trip of a lifetime! Send GO to 83600 now. 150p/msg rcvd. CustCare:08718720201
Spam,URGENT! We are trying to contact U. Todays draw shows that you have won a £2000 prize GUARANTEED. Call 09066358361 from land line. Claim Y87. Valid 12hrs only
Not Spam,Lol ... I really need to remember to eat when I'm drinking but I do appreciate you keeping me company that night babe *smiles*
Spam,You'll not rcv any more msgs from the chat svc. For FREE Hardcore services text GO to: 69988 If u get nothing u must Age Verify with yr network & try again
Spam,Call from 08702490080 - tells u 2 call 09066358152 to claim £5000 prize. U have 2 enter all ur mobile & personal details @ the prompts. Careful!
Spam,Ur HMV Quiz cash-balance is currently £500 - to maximize ur cash-in now send HMV1 to 86688 only 150p/msg
Not Spam,Or I guess  &lt;#&gt;  min
Not Spam,Missed your call cause I was yelling at scrappy. Miss u. Can't wait for u to come home. I'm so lonely today.
Not Spam,They r giving a second chance to rahul dengra.
Not Spam,Great comedy..cant stop laughing da:)
Spam,8007 25p 4 Alfie Moon's Children in Need song on ur mob. Tell ur m8s. Txt TONE CHARITY to 8007 for nokias or POLY CHARITY for polys :zed 08701417012 profit 2 charity
Spam,"This weeks SavaMob member offers are now accessible. Just call 08709501522 for details! SavaMob, POBOX 139, LA3 2WU. Only £1.50/week. SavaMob - offers mobile!"
Spam,IMPORTANT MESSAGE. This is a final contact attempt. You have important messages waiting out our customer claims dept. Expires 13/4/04. Call 08717507382 NOW!
Not Spam,"Hey ! I want you ! I crave you ! I miss you ! I need you ! I love you, Ahmad Saeed al Hallaq ..."
Not Spam,"You aren't coming home between class, right? I need to work out and shower!"
Not Spam,K. I will sent it again
Not Spam,Aight ill get on fb in a couple minutes
Spam,"Dear Voucher Holder, To claim this weeks offer, at you PC please go to http://www.e-tlp.co.uk/expressoffer Ts&Cs apply. To stop texts, txt STOP to 80062"
Not Spam,I borrow ur bag ok.
Spam,"Sunshine Hols. To claim ur med holiday send a stamped self address envelope to Drinks on Us UK, PO Box 113, Bray, Wicklow, Eire. Quiz Starts Saturday! Unsub Stop"
Spam,Bought one ringtone and now getting texts costing 3 pound offering more tones etc
Spam,I don't know u and u don't know me. Send CHAT to 86688 now and let's find each other! Only 150p/Msg rcvd. HG/Suite342/2Lands/Row/W1J6HL LDN. 18 years or over.
Not Spam,"Think i might have to give it a miss. Am teaching til twelve, then have lecture at two. Damn this working thing."
Not Spam,What not under standing.
Not Spam,Yeah confirmed for you staying at  that weekend
Not Spam,Did you get any gift? This year i didnt get anything. So bad
Spam,Thanks 4 your continued support Your question this week will enter u in2 our draw 4 £100 cash. Name the NEW US President? txt ans to 80082
Not Spam,Watching tv lor...
Not Spam,Thanks for your message. I really appreciate your sacrifice. I'm not sure of the process of direct pay but will find out on my way back from the test tomorrow. I'm in class now. Do have a wonderful day.
Spam,"Your account has been credited with 500 FREE Text Messages. To activate, just txt the word: CREDIT to No: 80488 T&Cs www.80488.biz"
Not Spam,True lov n care wil nevr go unrecognized. though somone often makes mistakes when valuing it. but they will definitly undrstnd once when they start missing it.
Spam,"Dear Voucher Holder, To claim this weeks offer, at you PC please go to http://www.e-tlp.co.uk/reward. Ts&Cs apply."
Not Spam,I cant pick the phone right now. Pls send a message
Spam,"Xmas & New Years Eve tickets are now on sale from the club, during the day from 10am till 8pm, and on Thurs, Fri & Sat night this week. They're selling fast!"
Spam,"You have been specially selected to receive a ""3000 award! Call 08712402050 BEFORE the lines close. Cost 10ppm. 16+. T&Cs apply. AG Promo"
Not Spam,Ok no prob
Spam,"Auction round 4. The highest bid is now £54. Next maximum bid is £71. To bid, send BIDS e. g. 10 (to bid £10) to 83383. Good luck."
Spam,You have 1 new message. Call 0207-083-6089
Not Spam,Tessy..pls do me a favor. Pls convey my birthday wishes to Nimya..pls dnt forget it. Today is her birthday Shijas
Spam,Ever thought about living a good life with a perfect partner? Just txt back NAME and AGE to join the mobile community. (100p/SMS)
Spam,CDs 4u: Congratulations ur awarded £500 of CD gift vouchers or £125 gift guaranteed & Freeentry 2 £100 wkly draw xt MUSIC to 87066 TnCs www.ldew.com1win150ppmx3age16
Spam,Reply to win £100 weekly! What professional sport does Tiger Woods play? Send STOP to 87239 to end service
Not Spam,Goin to workout lor... Muz lose e fats...
Not Spam,"Single line with a big meaning::::: ""Miss anything 4 ur ""Best Life"" but, don't miss ur best life for anything... Gud nyt..."
Spam,Great News! Call FREEFONE 08006344447 to claim your guaranteed £1000 CASH or £2000 gift. Speak to a live operator NOW!
Not Spam,Nope. Meanwhile she talk say make i greet you.
Not Spam,The world's most happiest frnds never have the same characters... Dey just have the best understanding of their differences...
Not Spam,Den wat will e schedule b lk on sun?
Spam,Congratulations ur awarded 500 of CD vouchers or 125gift guaranteed & Free entry 2 100 wkly draw txt MUSIC to 87066 TnCs www.Ldew.com1win150ppmx3age16
Spam,Ur cash-balance is currently 500 pounds - to maximize ur cash-in now send GO to 86688 only 150p/meg. CC: 08718720201 HG/Suite342/2lands Row/W1j6HL
Not Spam,She left it very vague. She just said she would inform the person in accounting about the delayed rent and that i should discuss with the housing agency about my renting another place. But checking online now and all places around usc are  &lt;#&gt;  and up
Spam,Would you like to see my XXX pics they are so hot they were nearly banned in the uk!
Not Spam,"Right on brah, see you later"
Not Spam,Oh ok.. Wat's ur email?
Spam,TBS/PERSOLVO. been chasing us since Sept for£38 definitely not paying now thanks to your information. We will ignore them. Kath. Manchester.
Not Spam,U reach orchard already? U wan 2 go buy tickets first?
Spam,URGENT We are trying to contact you Last weekends draw shows u have won a £1000 prize GUARANTEED Call 09064017295 Claim code K52 Valid 12hrs 150p pm
Spam,"Had your contract mobile 11 Mnths? Latest Motorola, Nokia etc. all FREE! Double Mins & Text on Orange tariffs. TEXT YES for callback, no to remove from records"
Spam,Please CALL 08712402578 immediately as there is an urgent message waiting for you
Spam,"URGENT! Your mobile number *************** WON a £2000 Bonus Caller prize on 10/06/03! This is the 2nd attempt to reach you! Call 09066368753 ASAP! Box 97N7QP, 150ppm"
Spam,PRIVATE! Your 2003 Account Statement for 07973788240 shows 800 un-redeemed S. I. M. points. Call 08715203649 Identifier Code: 40533 Expires 31/10/04
Not Spam,"Got fujitsu, ibm, hp, toshiba... Got a lot of model how to say..."
Spam,"Eerie Nokia tones 4u, rply TONE TITLE to 8007 eg TONE DRACULA to 8007 Titles: GHOST, ADDAMSFA, MUNSTERS, EXORCIST, TWILIGHT www.getzed.co.uk POBox36504W45WQ 150p"
Spam,Todays Vodafone numbers ending with 4882 are selected to a receive a £350 award. If your number matches call 09064019014 to receive your £350 award.
Not Spam,Carlos is taking his sweet time as usual so let me know when you and patty are done/want to smoke and I'll tell him to haul ass
Spam,Dear U've been invited to XCHAT. This is our final attempt to contact u! Txt CHAT to 86688
Spam,"Loan for any purpose £500 - £75,000. Homeowners + Tenants welcome. Have you been previously refused? We can still help. Call Free 0800 1956669 or text back 'help'"
Not Spam,No we sell it all so we'll have tons if coins. Then sell our coins to someone thru paypal. Voila! Money back in life pockets:)
Not Spam,R u in this continent?
Spam,WIN a £200 Shopping spree every WEEK Starting NOW. 2 play text STORE to 88039. SkilGme. TsCs08714740323 1Winawk! age16 £1.50perweeksub.
Not Spam,Omg if its not one thing its another. My cat has worms :/ when does this bad day end?
Not Spam,"Haha, my friend tyler literally just asked if you could get him a dubsack"
Not Spam,There bold 2  &lt;#&gt; . Is that yours
Spam,Hard LIVE 121 chat just 60p/min. Choose your girl and connect LIVE. Call 09094646899 now! Cheap Chat UK's biggest live service. VU BCM1896WC1N3XX
Not Spam,Oh k.i think most of wi and nz players unsold.
Spam,Free entry in 2 a weekly comp for a chance to win an ipod. Txt POD to 80182 to get entry (std txt rate) T&C's apply 08452810073 for details 18+
Not Spam,"I'm eatin now lor, but goin back to work soon... E mountain deer show huh... I watch b4 liao, very nice..."
Spam,87077: Kick off a new season with 2wks FREE goals & news to ur mobile! Txt ur club name to 87077 eg VILLA to 87077
Spam,Please call our customer service representative on FREEPHONE 0808 145 4742 between 9am-11pm as you have WON a guaranteed £1000 cash or £5000 prize!
Not Spam,ME 2 BABE I FEEL THE SAME LETS JUST 4GET ABOUT IT+BOTH TRY +CHEER UP+NOT FIT SOO MUCHXXLOVE U LOCAXX
Not Spam,Oic cos me n my sis got no lunch today my dad went out... So dunno whether 2 eat in sch or wat...
Spam,Ringtone Club: Get the UK singles chart on your mobile each week and choose any top quality ringtone! This message is free of charge.
Spam,Text BANNEDUK to 89555 to see! cost 150p textoperator g696ga 18+ XXX
Not Spam,"Hello, my love! How goes that day ? I wish your well and fine babe and hope that you find some job prospects. I miss you, boytoy ... *a teasing kiss*"
Not Spam,Kaiez... Enjoy ur tuition... Gee... Thk e second option sounds beta... I'll go yan jiu den msg u...
Not Spam,Yes..he is really great..bhaji told kallis best cricketer after sachin in world:).very tough to get out.
Spam,Bloomberg -Message center +447797706009 Why wait? Apply for your future http://careers. bloomberg.com
Spam,"WELL DONE! Your 4* Costa Del Sol Holiday or £5000 await collection. Call 09050090044 Now toClaim. SAE, TCs, POBox334, Stockport, SK38xh, Cost£1.50/pm, Max10mins"
Spam,83039 62735=£450 UK Break AccommodationVouchers terms & conditions apply. 2 claim you mustprovide your claim number which is 15541
Spam,Great News! Call FREEFONE 08006344447 to claim your guaranteed £1000 CASH or £2000 gift. Speak to a live operator NOW!
Spam,Block Breaker now comes in deluxe format with new features and great graphics from T-Mobile. Buy for just £5 by replying GET BBDELUXE and take the challenge
Spam,Your 2004 account for 07XXXXXXXXX shows 786 unredeemed points. To claim call 08719181259 Identifier code: XXXXX Expires 26.03.05
Not Spam,True dear..i sat to pray evening and felt so.so i sms'd you in some time...
Not Spam,How long does applebees fucking take
Not Spam,Da my birthdate in certificate is in april but real date is today. But dont publish it. I shall give you a special treat if you keep the secret. Any way thanks for the wishes
Spam,8007 FREE for 1st week! No1 Nokia tone 4 ur mob every week just txt NOKIA to 8007 Get txting and tell ur mates www.getzed.co.uk POBox 36504 W4 5WQ norm 150p/tone 16+
Not Spam,Heart is empty without love.. Mind is empty without wisdom.. Eyes r empty without dreams &amp; Life is empty without frnds.. So Alwys Be In Touch. Good night &amp; sweet dreams
Not Spam,Yes its possible but dint try. Pls dont tell to any one k
Not Spam,U sure u can't take any sick time?
Spam,Knock Knock Txt whose there to 80082 to enter r weekly draw 4 a £250 gift voucher 4 a store of yr choice. T&Cs www.tkls.com age16 to stoptxtstop£1.50/week
Not Spam,When you guys planning on coming over?
Not Spam,Just seeing your missed call my dear brother. Do have a gr8 day.
Spam,"TheMob>Hit the link to get a premium Pink Panther game, the new no. 1 from Sugababes, a crazy Zebra animation or a badass Hoody wallpaper-all 4 FREE!"
Not Spam,Nothing spl..wat abt u and whr ru?
Not Spam,"New Theory: Argument wins d SITUATION, but loses the PERSON. So dont argue with ur friends just.. . . . kick them &amp; say, I'm always correct.!"
Spam,Get the official ENGLAND poly ringtone or colour flag on yer mobile for tonights game! Text TONE or FLAG to 84199. Optout txt ENG STOP Box39822 W111WX £1.50
Spam,"Thanks for your ringtone order, ref number K718. Your mobile will be charged £4.50. Should your tone not arrive please call customer services on 09065069120"
Not Spam,"My Parents, My Kidz, My Friends n My Colleagues. All screaming.. SURPRISE !! and I was waiting on the sofa.. ... ..... ' NAKED...!"
Spam,"Had your contract mobile 11 Mnths? Latest Motorola, Nokia etc. all FREE! Double Mins & Text on Orange tariffs. TEXT YES for callback, no to remove from records."
Spam,LORD OF THE RINGS:RETURN OF THE KING in store NOW!REPLY LOTR by 2 June 4 Chance 2 WIN LOTR soundtrack CDs StdTxtRate. Reply STOP to end txts
Spam,**FREE MESSAGE**Thanks for using the Auction Subscription Service. 18 . 150p/MSGRCVD 2 Skip an Auction txt OUT. 2 Unsubscribe txt STOP CustomerCare 08718726270
Spam,A £400 XMAS REWARD IS WAITING FOR YOU! Our computer has randomly picked you from our loyal mobile customers to receive a £400 reward. Just call 09066380611
Spam,Get a brand new mobile phone by being an agent of The Mob! Plus loads more goodies! For more info just text MAT to 87021.
Not Spam,I will vote for wherever my heart guides me
Not Spam,"Got hella gas money, want to go on a grand nature adventure with galileo in a little bit?"
Spam,"If you don't, your prize will go to another customer. T&C at www.t-c.biz 18+ 150p/min Polo Ltd Suite 373 London W1J 6HL Please call back if busy"
Spam,You will recieve your tone within the next 24hrs. For Terms and conditions please see Channel U Teletext Pg 750
Not Spam,"I'll see, but prolly yeah"
Not Spam,Also remember to get dobby's bowl from your car
Not Spam,Ü still got lessons?  Ü in sch?
Spam,"If you don't, your prize will go to another customer. T&C at www.t-c.biz 18+ 150p/min Polo Ltd Suite 373 London W1J 6HL Please call back if busy"
Not Spam,No da:)he is stupid da..always sending like this:)don believe any of those message.pandy is a mental:)
Spam,Free entry in 2 a wkly comp to win FA Cup final tkts 21st May 2005. Text FA to 87121 to receive entry question(std txt rate)T&C's apply 08452810075over18's
Not Spam,Was the actual exam harder than NBME
Spam,YOU ARE CHOSEN TO RECEIVE A £350 AWARD! Pls call claim number 09066364311 to collect your award which you are selected to receive as a valued mobile customer.
Spam,"Dear Matthew please call 09063440451 from a landline, your complimentary 4*Lux Tenerife holiday or £1000 CASH await collection. ppm150 SAE T&Cs Box334 SK38XH."
Not Spam,Can you let me know details of fri when u find out cos I'm not in tom or fri. mentionned chinese. Thanks
Spam,FREE>Ringtone! Reply REAL or POLY eg REAL1 1. PushButton 2. DontCha 3. BabyGoodbye 4. GoldDigger 5. WeBeBurnin 1st tone FREE and 6 more when u join for £3/wk
Not Spam,Hurry home u big butt. Hang up on your last caller if u have to. Food is done and I'm starving. Don't ask what I cooked.
Not Spam,So li hai... Me bored now da lecturer repeating last weeks stuff waste time...
Not Spam,I'm home.
Not Spam,"Aight, let me know when you're gonna be around usf"
Spam,PRIVATE! Your 2003 Account Statement for shows 800 un-redeemed S.I.M. points. Call 08718738001 Identifier Code: 49557 Expires 26/11/04
Not Spam,To day class is there are no class.
Not Spam,Wat time u finish ur lect today?
Not Spam,Great to hear you are settling well. So what's happenin wit ola?
Not Spam,Quite ok but a bit ex... U better go eat smth now else i'll feel guilty...
Not Spam,Go chase after her and run her over while she's crossing the street
Spam,Bloomberg -Message center +447797706009 Why wait? Apply for your future http://careers. bloomberg.com
Spam,PRIVATE! Your 2003 Account Statement for 07815296484 shows 800 un-redeemed S.I.M. points. Call 08718738001 Identifier Code 41782 Expires 18/11/04
Spam,Ur cash-balance is currently 500 pounds - to maximize ur cash-in now send GO to 86688 only 150p/msg. CC 08718720201 HG/Suite342/2Lands Row/W1J6HL
Spam,FREE camera phones with linerental from 4.49/month with 750 cross ntwk mins. 1/2 price txt bundle deals also avble. Call 08001950382 or call2optout/J MF
Spam,"Wan2 win a Meet+Greet with Westlife 4 U or a m8? They are currently on what tour? 1)Unbreakable, 2)Untamed, 3)Unkempt. Text 1,2 or 3 to 83049. Cost 50p +std text"
Spam,Todays Voda numbers ending 1225 are selected to receive a £50award. If you have a match please call 08712300220 quoting claim code 3100 standard rates app
Spam,PRIVATE! Your 2003 Account Statement for 07808 XXXXXX shows 800 un-redeemed S. I. M. points. Call 08719899217 Identifier Code: 41685 Expires 07/11/04
Spam,Congratulations ur awarded either £500 of CD gift vouchers & Free entry 2 our £100 weekly draw txt MUSIC to 87066 TnCs www.Ldew.com1win150ppmx3age16
Spam,2/2 146tf150p
Not Spam,"I hope your alright babe? I worry that you might have felt a bit desparate when you learned the job was a fake ? I am here waiting when you come back, my love"
Not Spam,Kind of. Took it to garage. Centre part of exhaust needs replacing. Part ordered n taking it to be fixed tomo morning.
Spam,EASTENDERS TV Quiz. What FLOWER does DOT compare herself to? D= VIOLET E= TULIP F= LILY txt D E or F to 84025 NOW 4 chance 2 WIN £100 Cash WKENT/150P16+
Spam,"New Mobiles from 2004, MUST GO! Txt: NOKIA to No: 89545 & collect yours today! From ONLY £1. www.4-tc.biz 2optout 087187262701.50gbp/mtmsg18 TXTAUCTION."
Not Spam,CHEERS LOU! YEAH WAS A GOODNITE SHAME U NEVA CAME! C YA GAILxx
Spam,"URGENT! You have won a 1 week FREE membership in our £100,000 Prize Jackpot! Txt the word: CLAIM to No: 81010 T&C www.dbuk.net LCCLTD POBOX 4403LDNW1A7RW18"
Not Spam,Hope you are having a good week. Just checking in
Spam,"Bears Pic Nick, and Tom, Pete and ... Dick. In fact, all types try gay chat with photo upload call 08718730666 (10p/min). 2 stop texts call 08712460324"
Not Spam,No. I dont want to hear anything
Spam,"Double mins and txts 4 6months FREE Bluetooth on Orange. Available on Sony, Nokia Motorola phones. Call MobileUpd8 on 08000839402 or call2optout/N9DX"
Spam,"You've won tkts to the EURO2004 CUP FINAL or £800 CASH, to collect CALL 09058099801 b4190604, POBOX 7876150ppm"
Spam,PRIVATE! Your 2004 Account Statement for 07742676969 shows 786 unredeemed Bonus Points. To claim call 08719180248 Identifier Code: 45239 Expires
Spam,"HOT LIVE FANTASIES call now 08707509020 Just 20p per min NTT Ltd, PO Box 1327 Croydon CR9 5WB 0870 is a national rate call"
Spam,"URGENT!! Your 4* Costa Del Sol Holiday or £5000 await collection. Call 09050090044 Now toClaim. SAE, TC s, POBox334, Stockport, SK38xh, Cost£1.50/pm, Max10mins"
Spam,Text & meet someone sexy today. U can find a date or even flirt its up to U. Join 4 just 10p. REPLY with NAME & AGE eg Sam 25. 18 -msg recd@thirtyeight pence
Not Spam,"Yeah, that's fine! It's £6 to get in, is that ok?"
Spam,FREE entry into our £250 weekly comp just send the word WIN to 80086 NOW. 18 T&C www.txttowin.co.uk
Not Spam,"Cool, text me when you're ready"
Not Spam,Get down in gandhipuram and walk to cross cut road. Right side &lt;#&gt; street road and turn at first right.
Spam,"Dear Voucher Holder, To claim this weeks offer, at your PC please go to http://www.wtlp.co.uk/text. Ts&Cs apply."
Spam,Warner Village 83118 C Colin Farrell in SWAT this wkend @Warner Village & get 1 free med. Popcorn!Just show msg+ticket@kiosk.Valid 4-7/12. C t&c @kiosk. Reply SONY 4 mre film offers
Not Spam,"Wow. I never realized that you were so embarassed by your accomodations. I thought you liked it, since i was doing the best i could and you always seemed so happy about ""the cave"". I'm sorry I didn't and don't have more to give. I'm sorry i offered. I'm sorry your room was so embarassing."
Spam,"Spook up your mob with a Halloween collection of a logo & pic message plus a free eerie tone, txt CARD SPOOK to 8007 zed 08701417012150p per logo/pic"
Spam,"Hottest pics straight to your phone!! See me getting Wet and Wanting, just for you xx Text PICS to 89555 now! txt costs 150p textoperator g696ga 18 XxX"
Not Spam,"Solve d Case : A Man Was Found Murdered On  &lt;DECIMAL&gt; . &lt;#&gt;  AfterNoon. 1,His wife called Police. 2,Police questioned everyone. 3,Wife: Sir,I was sleeping, when the murder took place. 4.Cook: I was cooking. 5.Gardener: I was picking vegetables. 6.House-Maid: I went 2 d post office. 7.Children: We went 2 play. 8.Neighbour: We went 2 a marriage. Police arrested d murderer Immediately. Who's It? Reply With Reason, If U r Brilliant."
Not Spam,Mm not entirely sure i understood that text but hey. Ho. Which weekend?
Not Spam,"Sorry sir, i will call you tomorrow.  senthil.hsbc"
Not Spam,I dont understand your message.
Spam,"XXXMobileMovieClub: To use your credit, click the WAP link in the next txt message or click here>> http://wap. xxxmobilemovieclub.com?n=QJKGIGHJJGCBL"
Spam,Do you want a New Nokia 3510i colour phone DeliveredTomorrow? With 300 free minutes to any mobile + 100 free texts + Free Camcorder reply or call 08000930705.
Spam,"Congrats! 1 year special cinema pass for 2 is yours. call 09061209465 now! C Suprman V, Matrix3, StarWars3, etc all 4 FREE! bx420-ip4-5we. 150pm. Dont miss out!"
Spam,"Mila, age23, blonde, new in UK. I look sex with UK guys. if u like fun with me. Text MTALK to 69866.18 . 30pp/txt 1st 5free. £1.50 increments. Help08718728876"
Not Spam,Aiyo a bit pai seh ü noe... Scared he dun rem who i am then die... Hee... But he become better lookin oredi leh...
Not Spam,Is she replying. Has boye changed his phone number
Not Spam,One small prestige problem now.
Spam,"SPJanuary Male Sale! Hot Gay chat now cheaper, call 08709222922. National rate from 1.5p/min cheap to 7.8p/min peak! To stop texts call 08712460324 (10p/min)"
Spam,PRIVATE! Your 2003 Account Statement for shows 800 un-redeemed S.I.M. points. Call 08715203685 Identifier Code:4xx26 Expires 13/10/04
Not Spam,"Sorry, I guess whenever I can get a hold of my connections, maybe an hour or two? I'll text you"
Spam,Please CALL 08712402779 immediately as there is an urgent message waiting for you
Spam,Congratulations ur awarded 500 of CD vouchers or 125gift guaranteed & Free entry 2 100 wkly draw txt MUSIC to 87066 TnCs www.Ldew.com1win150ppmx3age16
Spam,New TEXTBUDDY Chat 2 horny guys in ur area 4 just 25p Free 2 receive Search postcode or at gaytextbuddy.com. TXT ONE name to 89693. 08715500022 rpl Stop 2 cnl
Spam,UR awarded a City Break and could WIN a £200 Summer Shopping spree every WK. Txt STORE to 88039 . SkilGme. TsCs087147403231Winawk!Age16 £1.50perWKsub
Not Spam,I liked the new mobile
Spam,XMAS iscoming & ur awarded either £500 CD gift vouchers & free entry 2 r £100 weekly draw txt MUSIC to 87066 TnC www.Ldew.com1win150ppmx3age16subscription
Spam,Want a new Video Phone? 750 anytime any network mins? Half price line rental free text for 3 months? Reply or call 08000930705 for free delivery
Not Spam,Hey morning what you come to ask:-) pa...
Not Spam,Congratulations ore mo owo re wa. Enjoy it and i wish you many happy moments to and fro wherever you go
Not Spam,We r outside already.
Not Spam,Sending you greetings of joy and happiness. Do have a gr8 evening
Not Spam,* Was thinking about chuckin ur red green n black trainners 2 save carryin them bac on train
Not Spam,At what time are you coming.
Spam,You have won a guaranteed £200 award or even £1000 cashto claim UR award call free on 08000407165 (18+) 2 stop getstop on 88222 PHP
Spam,"Sppok up ur mob with a Halloween collection of nokia logo&pic message plus a FREE eerie tone, txt CARD SPOOK to 8007"
Spam,Please call our customer service representative on 0800 169 6031 between 10am-9pm as you have WON a guaranteed £1000 cash or £5000 prize!
Not Spam,Oops I was in the shower when u called. Hey a parking garage collapsed at university hospital. See I'm not crazy. Stuff like that DOES happen.
